Date,AgentName,CallsHandled,AvgHandleTimeSeconds,CSAT,Adherence,Compliance,Notes,Call_Type,Issue_Type,Resolution_Status,コール開始時間,コール終了時間
2025-10-01T00:00:00,タナカ,,294,99 %,78 %,97 %,,受電 ,アカウント / Account,Partially Resolved,NULL,NULL
01-10-2025,Maeda BB,27,352,87,92,96,"customer requested callback, weird spike",inbound ,返品 / Return,一次対応のみ,2025/10/01 10:54,11:04:00
2025年10月01日,Maeda BB,27,216,75,98,100,,チャット,アカウント / Account,一次対応のみ,2025/10/01 10:13,10:26
2025-10-01T00:00:00+09:00,Kondo OO,45,399,73,NULL,,,OUT-BOUND,アカウント / Account,Resolved,2025-10-01T15:24:00+09:00,2025-10-01T15:41:00+09:00
2025/10/01,WATANABE E,31,412 sec,81,94,98,クレーム傾向あり,受電 ,技術サポート / Tech support,Transfer to L2,16:01:00,16:07
2025-10-01T00:00:00+09:00,Kobayashi I,１５,215,NULL,95,91,"※手動で確認, QA to review, manual check required",発信,その他 / Other,Resolved,12:14,12:19
2025-10-01T00:00:00,ワタナベ,13,349 sec,96,96,94,"QA to review, 新人対応",inbound ,支払いエラー / Payment error,解決済み / Resolved,15:46,15:59
10/01/2025, Yamaguchi N ,NUL,NUL,69,95 %,96,urgent,発信,返品 / Return,コールバック予定,,
2025年10月01日,Kimura Q,39,554,74,79,88 %,"urgent
日本語メモあり
クレーム傾向あり",OUT-BOUND,支払いエラー / Payment error,Resolved,19:55,2025-10-01T20:05:00+09:00
2025-10-01T00:00:00,Fujii MM,43,522,84,80 %,97,,メール,請求 / Billing,Transfer to L2,10:56:00,2025-10-01T11:06:00+09:00
2025/10/01,HASEGAWA KK,16,NULL,NULL,NULL,92,"manual check required, ※手動で確認, クレーム傾向あり",inbound ,支払いエラー / Payment error,コールバック予定,13:02:00,13:05
10/01/2025,サトウ,37,NULL,74,96,,N/A,Outbound,支払いエラー / Payment error,Transfer to L2,21:35,21:51
10/01/2025,スズキ,,350,80,８１,91,weird spike,Outbound,アカウント / Account,Transfer to L2,2025/10/01 13:55,14:00:00
2025-10-01T00:00:00,INOUE P,26,315 sec,87,97,91,,受電 ,返品 / Return,Transfer to L2,2025-10-01T15:04:00+09:00,15:17:00
2025年10月01日,Hayashi R,30,245,76,95,100,"manual check required, weird spike",OUT-BOUND,支払いエラー / Payment error,一次対応のみ,17:42,17:55:00
2025-10-01T00:00:00+09:00,NAKAJIMA AA,NUL,7200,69,96,91,double break?,OUT-BOUND,その他 / Other,解決済み / Resolved,17:15:00,2025/10/01 17:21
01-10-2025,Fujii MM,37,261,80,94,99,"needs coaching
urgent
VIP customer",OUT-BOUND,返品 / Return,Resolved,15:26,2025/10/01 15:39
2025/10/01,Kimura Q,11,374,89,91,91,"N/A, manual check required",受電,請求 / Billing,エスカレーション,,
2025/10/01,Sakamoto II,１１,416,94,90,89,,チャット,返品 / Return,Resolved,21:41,2025-10-01T21:45:00+09:00
2025-10-01T00:00:00+09:00,Fujii MM,40,291,72,８７,98,needs coaching,Outbound,支払いエラー / Payment error,一次対応のみ,2025-10-01T19:38:00+09:00,19:44:00
10/01/2025, Yamaguchi N ,14,395,94,94,96,"※手動で確認, N/A, weird spike",Inbound,キャンセル / Cancellation,エスカレーション,12:48:00,2025-10-01T13:05:00+09:00
2025年10月01日, Abe W ,23,323,65,85,99,needs coaching,受電,返品 / Return,一次対応のみ,2025/10/01 19:37,19:51:00
01-10-2025,Murakami EE,29,NULL,150 %,100,99,weird spike,チャット,請求 / Billing,一次対応のみ,NULL,NULL
2025/10/01,Kobayashi I,18,232,93,86,94,urgent,メール,支払いエラー / Payment error,Partially Resolved,10:35,2025/10/01 10:51
10/01/2025,Emily T,37,４９２,78,NULL,96 %,,発信,その他 / Other,一次対応のみ,2025/10/01 09:14,2025-10-01T09:26:00+09:00
2025-10-01T00:00:00+09:00,WATANABE E,22,511,NULL,NUL,97,,Inbound,その他 / Other,一次対応のみ,2025-10-01T20:25:00+09:00,2025-10-01T20:36:00+09:00
01-10-2025,nakamura h,２６,525,82,83,90,新人対応,チャット,配送遅延 / Delivery delay,Resolved,2025/10/01 11:21,2025-10-01T11:37:00+09:00
2025-10-01T00:00:00,Matsumoto O,30,４４３,94,89,88,"VIP customer
新人対応",発信 ,返品 / Return,Unresolved,2025-10-01T13:35:00+09:00,2025/10/01 13:38
01-10-2025,ITO F,41,541,80,84,89,"※手動で確認, 日本語メモあり, double break?",発信 ,その他 / Other,Unresolved,2025/10/01 16:34,2025/10/01 16:52
2025-10-01T00:00:00+09:00,Goto NN,25,577,89,98,,"N/A
needs coaching
新人対応",発信,技術サポート / Tech support,Unresolved,15:55:00,16:02:00
02-10-2025,Fujii MM,15,453,96,,NUL,"weird spike
VIP customer",Inbound,支払いエラー / Payment error,エスカレーション,NULL,NULL
2025年10月02日,Kobayashi I,37,469,150,99,95,"※手動で確認, manual check required",Inbound,その他 / Other,Transfer to L2,18:19:00,18:35
10/02/2025,Kimura Q,NUL,363,90,99,99,,Outbound,配送遅延 / Delivery delay,Partially Resolved,19:12,2025-10-02T19:23:00+09:00
02-10-2025,タナカ,,197,NUL,91,93,"新人対応, ※手動で確認",チャット,支払いエラー / Payment error,エスカレーション,2025/10/02 10:09,10:19:00
10/02/2025,Alex Q,,412,89,81,96,"新人対応, VIP customer, ※手動で確認",Inbound,請求 / Billing,解決済み / Resolved,09:19,2025/10/02 09:37
2025年10月02日,Matsumoto O,44,259,91,100,93 %,"manual check required
N/A
日本語メモあり",Outbound,支払いエラー / Payment error,エスカレーション,2025-10-02T10:42:00+09:00,2025-10-02T10:51:00+09:00
2025-10-02T00:00:00+09:00,john s,２３,286,74,86,92,日本語メモあり,Outbound,配送遅延 / Delivery delay,解決済み / Resolved,2025-10-02T11:16:00+09:00,2025-10-02T11:20:00+09:00
10/02/2025, Mori V ,42,２９３,98,78 %,94,"needs coaching
double break?",OUT-BOUND,支払いエラー / Payment error,Unresolved,13:39:00,2025/10/02 13:59
2025/10/02,Hayashi R,17,573,79,90,98,"needs coaching, double break?",Inbound,アカウント / Account,Resolved,20:47:00,2025-10-02T21:01:00+09:00
2025年10月02日,Aoki HH,37,327,78,81,92,"customer requested callback, manual check required, VIP customer",発信 ,キャンセル / Cancellation,解決済み / Resolved,11:17,11:29
02-10-2025, Maria R ,19,226,86,88,NULL,,OUT-BOUND,技術サポート / Tech support,Resolved,13:28:00,13:44
2025/10/02,SHIMIZU S,NUL,325,84 %,97 %,91,,Inbound,技術サポート / Tech support,エスカレーション,20:27,20:35:00
10/02/2025, Saito T ,12,219,91,88,99,QA to review,受電 ,支払いエラー / Payment error,コールバック予定,2025-10-02T13:47:00+09:00,2025-10-02T14:00:00+09:00
2025/10/02,Endo GG,32,510,NULL,97,NUL,"新人対応, double break?, customer requested callback",発信,配送遅延 / Delivery delay,Transfer to L2,11:28:00,2025-10-02T11:33:00+09:00
2025/10/02,Murakami EE,NULL,199 sec,69,80,96,,発信 ,返品 / Return,Transfer to L2,NULL,NULL
2025年10月02日,Ogawa DD,15,NUL,93,97,94,,チャット,支払いエラー / Payment error,Transfer to L2,10:35,10:50:00
2025/10/02,Alex Q,32,519,84,88,99,,受電,配送遅延 / Delivery delay,解決済み / Resolved,2025/10/02 14:19,14:27
2025-10-02T00:00:00+09:00,NAKAJIMA AA,28,NULL,98 %,97,99,,発信,技術サポート / Tech support,コールバック予定,2025/10/02 14:43,14:53
2025-10-02T00:00:00+09:00, Yamaguchi N ,40,NUL,93,90,91,,発信,配送遅延 / Delivery delay,Resolved,20:54,21:13:00
2025/10/02,Emily T,NUL,293,91 %,85,93,urgent,発信,請求 / Billing,エスカレーション,NULL,NULL
2025-10-02T00:00:00+09:00,FUJITA CC,43,３０１,94 %,９３,91,,チャット,返品 / Return,コールバック予定,2025-10-02T11:42:00+09:00,2025/10/02 11:47
2025-10-02T00:00:00, Mori V ,33,7200,87,81,88,"新人対応, VIP customer, double break?",OUT-BOUND,支払いエラー / Payment error,エスカレーション,,
2025-10-02T00:00:00,Yamazaki U,29,４５８,83,98,94,新人対応,チャット,キャンセル / Cancellation,Resolved,20:27,20:32:00
2025-10-02T00:00:00,Goto NN,NULL,336,150,89,100,"クレーム傾向あり, VIP customer",inbound ,請求 / Billing,エスカレーション,09:08:00,2025/10/02 09:13
2025-10-02T00:00:00, Maria R ,38,570 sec,NULL,88,99,※手動で確認,発信,返品 / Return,一次対応のみ,2025-10-02T20:58:00+09:00,2025/10/02 21:16
02-10-2025,スズキ,15,343,83,100,93,,OUT-BOUND,返品 / Return,エスカレーション,09:23,2025-10-02T09:43:00+09:00
2025年10月02日, Saito T ,40,474 sec,69,89,97,needs coaching,メール,請求 / Billing,Unresolved,14:59:00,2025-10-02T15:09:00+09:00
2025-10-02T00:00:00+09:00,Kondo OO,45,494,150,99,97 %,日本語メモあり,発信 ,キャンセル / Cancellation,Partially Resolved,NULL,NULL
2025/10/02,タナカ,29,530,75,84,93,double break?,受電 ,支払いエラー / Payment error,Transfer to L2,2025-10-02T12:29:00+09:00,2025-10-02T12:35:00+09:00
10/02/2025,Yamamoto G,36,261,77,94,89,customer requested callback,inbound ,キャンセル / Cancellation,エスカレーション,NULL,NULL
10/03/2025,Ogawa DD,NUL,367,100,80,97,"N/A, double break?",チャット,請求 / Billing,Partially Resolved,NULL,NULL
03-10-2025,ハヤシ,40,NULL,73,83,97,"customer requested callback, ※手動で確認, 新人対応",チャット,配送遅延 / Delivery delay,Resolved,2025-10-03T15:37:00+09:00,2025/10/03 15:49
03-10-2025,Kondo OO,24,267,89 %,79,95,"クレーム傾向あり, customer requested callback",inbound ,請求 / Billing,Partially Resolved,17:20,2025/10/03 17:38
2025年10月03日, Yamaguchi N ,26,NUL,100,87,95,"※手動で確認, double break?, needs coaching",受電 ,アカウント / Account,コールバック予定,2025-10-03T14:49:00+09:00,14:56:00
03-10-2025,Emily T,40,318,NULL,96,91,"新人対応, needs coaching, manual check required",inbound ,請求 / Billing,コールバック予定,19:59:00,20:17:00
03-10-2025,Yamamoto G,NULL,513,67,８３,100,"日本語メモあり
double break?",発信 ,支払いエラー / Payment error,Transfer to L2,13:29,2025/10/03 13:49
2025-10-03T00:00:00+09:00,TAKAHASHI C,31,３１１,83,83,94,urgent,Outbound,技術サポート / Tech support,一次対応のみ,15:15:00,2025-10-03T15:32:00+09:00
03-10-2025,Kondo OO,２５,NULL,90,100,92,"urgent, 新人対応",発信 ,配送遅延 / Delivery delay,コールバック予定,20:35,20:53
2025/10/03,WATANABE E,15,365 sec,68,84,96,"needs coaching, クレーム傾向あり",inbound ,その他 / Other,Unresolved,17:26:00,2025-10-03T17:43:00+09:00
2025年10月03日,Sakamoto II,23,7200,69,NUL,95 %,double break?,受電,配送遅延 / Delivery delay,コールバック予定,16:55,17:10:00
2025-10-03T00:00:00+09:00,ITO F,35,294,94,95,90,日本語メモあり,受電,技術サポート / Tech support,Partially Resolved,2025-10-03T12:04:00+09:00,12:10
2025-10-03T00:00:00,サトウ,24,577 sec,83,96,93,"weird spike
QA to review
※手動で確認",受電 ,請求 / Billing,コールバック予定,2025/10/03 17:31,17:35:00
10/03/2025,Sasaki M,29,422,74,95,94,"N/A, needs coaching",Outbound,技術サポート / Tech support,一次対応のみ,15:43,2025/10/03 15:47
2025年10月03日,FUJITA CC,10,NUL,95,100,100,"※手動で確認, N/A",発信,その他 / Other,Resolved,21:46,22:04:00
10/03/2025,Goto NN,,559,91,85,98,"VIP customer, manual check required",発信,請求 / Billing,Transfer to L2,2025-10-03T11:08:00+09:00,2025-10-03T11:28:00+09:00
03-10-2025, Saito T ,,7200,NULL,８０,93 %,"新人対応
manual check required
double break?",受電 ,アカウント / Account,解決済み / Resolved,2025/10/03 09:33,09:44
2025-10-03T00:00:00,Ogawa DD,25,597,NUL,92,98,"double break?, 日本語メモあり, needs coaching",受電,その他 / Other,解決済み / Resolved,19:00:00,2025-10-03T19:08:00+09:00
2025-10-03T00:00:00,Endo GG,40,530,67,78,99,,発信 ,返品 / Return,コールバック予定,19:57,2025-10-03T20:17:00+09:00
03-10-2025,Hayashi R,１３,218,90,98,93,,発信 ,アカウント / Account,Resolved,2025-10-03T21:39:00+09:00,21:51:00
10/03/2025,Miyazaki JJ,19,234 sec,93,82 %,96,,チャット,支払いエラー / Payment error,Transfer to L2,15:00,15:12
10/03/2025,WATANABE E,27,212,69,98,90,"QA to review
N/A
新人対応",発信 ,請求 / Billing,一次対応のみ,2025/10/03 14:38,14:47:00
03-10-2025,Yamamoto G,41,346,72,95,,"weird spike, 新人対応, ※手動で確認",Inbound,アカウント / Account,エスカレーション,2025/10/03 11:40,2025/10/03 11:52
10/03/2025, Saito T ,40,５３４,99,81,98,"QA to review
N/A
double break?",Inbound,キャンセル / Cancellation,Partially Resolved,17:47,2025/10/03 18:06
10/03/2025,Noah W,42,427,72,89,95,"N/A
needs coaching",Inbound,技術サポート / Tech support,Transfer to L2,19:06,19:14
2025/10/03,john s,39,274,77,78,100,"urgent
N/A
VIP customer",Inbound,キャンセル / Cancellation,エスカレーション,2025-10-03T17:40:00+09:00,17:53:00
10/03/2025,Murakami EE,29,524,76,90,90,クレーム傾向あり,メール,請求 / Billing,Unresolved,2025-10-03T14:53:00+09:00,2025/10/03 15:10
2025-10-03T00:00:00+09:00,ハヤシ,45,530,75 %,,92 %,,メール,請求 / Billing,エスカレーション,2025-10-03T18:47:00+09:00,19:05:00
2025/10/03,miyazaki jj,33,569,71,85,93,double break?,Outbound,配送遅延 / Delivery delay,コールバック予定,2025-10-03T11:39:00+09:00,11:46:00
2025年10月03日, Yamaguchi N ,20,328,71 %,91,90,,チャット,返品 / Return,コールバック予定,2025-10-03T16:09:00+09:00,2025-10-03T16:20:00+09:00
2025/10/03,Sakamoto II,33,477 sec,70,99,94,,メール,配送遅延 / Delivery delay,一次対応のみ,14:35:00,2025-10-03T14:42:00+09:00
2025-10-04T00:00:00,ヤマダ,３９,２６０,77,98,89,"urgent, 日本語メモあり, QA to review",Outbound,アカウント / Account,Resolved,NULL,NULL
2025-10-04T00:00:00+09:00,Sofia V,３８,598,95 %,81,94,,OUT-BOUND,支払いエラー / Payment error,解決済み / Resolved,18:41,2025/10/04 18:49
04-10-2025,Fujii MM,２３,NULL,89,82,97,"日本語メモあり
manual check required
※手動で確認",発信 ,返品 / Return,コールバック予定,13:41,2025/10/04 13:45
2025-10-04T00:00:00,Kimura Q,14,364,91,93,,,メール,返品 / Return,解決済み / Resolved,2025/10/04 09:50,2025/10/04 10:05
10/04/2025,Sasaki M,NULL,４９５,NUL,82,98,"weird spike
日本語メモあり
double break?",受電,支払いエラー / Payment error,エスカレーション,18:38,2025-10-04T18:42:00+09:00
04-10-2025,ワタナベ,NUL,7200,87,86,92,"double break?
QA to review",Inbound,キャンセル / Cancellation,Resolved,16:29,16:48:00
2025年10月04日,Maeda BB,17,２０２,,82,,"VIP customer
manual check required
QA to review",Outbound,アカウント / Account,Transfer to L2,2025-10-04T13:52:00+09:00,13:57
2025/10/04,NAKAJIMA AA,３５,324,NUL,89,97,VIP customer,Outbound,請求 / Billing,解決済み / Resolved,2025-10-04T15:01:00+09:00,15:11:00
04-10-2025,ワタナベ,29,301,74,NULL,96,"needs coaching, customer requested callback, double break?",受電,支払いエラー / Payment error,解決済み / Resolved,15:42:00,2025/10/04 15:49
04-10-2025,Sasaki M,38,5,71,92,100,,Inbound,支払いエラー / Payment error,Unresolved,2025-10-04T21:43:00+09:00,21:55
2025-10-04T00:00:00+09:00,Goto NN,NULL,３６２,76 %,92,NULL,,OUT-BOUND,支払いエラー / Payment error,解決済み / Resolved,09:53:00,2025-10-04T10:03:00+09:00
2025/10/04,Sofia V,１４,5,93,NULL,１００,customer requested callback,受電,その他 / Other,解決済み / Resolved,15:43,15:59:00
10/04/2025,TAKAHASHI C,12,511,68 %,91,98,,受電,配送遅延 / Delivery delay,エスカレーション,17:50:00,2025/10/04 18:08
2025-10-04T00:00:00+09:00,TAKAHASHI C,,195,NUL,94,90,,inbound ,返品 / Return,コールバック予定,14:59:00,2025-10-04T15:07:00+09:00
04-10-2025,kondo ff,19,NUL,96,79 %,91 %,"customer requested callback, weird spike",チャット,請求 / Billing,Transfer to L2,2025-10-04T09:01:00+09:00,09:08:00
2025年10月04日, Saito T ,35,345,96,95,91,"VIP customer
※手動で確認
urgent",inbound ,アカウント / Account,解決済み / Resolved,11:38,2025-10-04T11:51:00+09:00
2025-10-04T00:00:00+09:00, Abe W ,14,265,86,85,99 %,"QA to review, urgent, double break?",受電,配送遅延 / Delivery delay,コールバック予定,10:53,11:11
2025-10-04T00:00:00,Emily T,12,233 sec,150,95,97,"urgent
customer requested callback
QA to review",Inbound,配送遅延 / Delivery delay,Partially Resolved,12:26:00,12:46:00
2025-10-04T00:00:00+09:00, Kato J ,NULL,461,92 %,98,,,メール,支払いエラー / Payment error,エスカレーション,10:19:00,2025-10-04T10:34:00+09:00
2025/10/04,Ikeda X,33,408 sec,81,79,NULL,"QA to review, customer requested callback, weird spike",受電,アカウント / Account,エスカレーション,NULL,NULL
2025-10-04T00:00:00,kondo ff,43,497,75,82 %,NUL,manual check required,発信 ,キャンセル / Cancellation,Transfer to L2,20:58:00,21:03:00
10/04/2025,Endo GG,10,447,NULL,96,97,"QA to review
※手動で確認",発信,その他 / Other,解決済み / Resolved,2025/10/04 11:17,2025-10-04T11:32:00+09:00
2025年10月04日,Sakamoto II,13,370 sec,84,100,92,"VIP customer, QA to review",Inbound,返品 / Return,エスカレーション,12:58:00,2025-10-04T13:14:00+09:00
2025-10-04T00:00:00+09:00,Hayashi R,NULL,386,66,84,93,"QA to review, manual check required, needs coaching",Outbound,配送遅延 / Delivery delay,エスカレーション,18:28:00,18:36:00
2025年10月04日,Maeda BB,15,263,79,86,100,,OUT-BOUND,技術サポート / Tech support,Partially Resolved,13:38:00,2025/10/04 13:50
2025年10月04日,Kimura Q,23,499,88,87,NUL,"N/A, ※手動で確認, VIP customer",メール,返品 / Return,Unresolved,2025/10/04 17:48,17:58:00
2025-10-04T00:00:00+09:00,WATANABE E,41,394,77,99,98,,受電 ,請求 / Billing,一次対応のみ,10:30,10:37:00
2025-10-04T00:00:00,Ikeda X,24,583,94,98,NUL,"needs coaching, manual check required, QA to review",受電,技術サポート / Tech support,Unresolved,2025/10/04 11:12,11:25
04-10-2025,Goto NN,15,２７０,78,83,NULL,"QA to review, double break?, VIP customer",受電,技術サポート / Tech support,解決済み / Resolved,17:12,2025-10-04T17:26:00+09:00
2025-10-04T00:00:00,WATANABE E,25,339,75 %,,95,"urgent
N/A
新人対応",Outbound,請求 / Billing,コールバック予定,2025-10-04T09:14:00+09:00,09:24
2025年10月05日,ITO F,12,５７４,71,,94,,OUT-BOUND,返品 / Return,解決済み / Resolved,13:26,2025/10/05 13:32
2025/10/05,Ogawa DD,17,434,98,９１,91,,inbound ,支払いエラー / Payment error,Resolved,2025-10-05T18:42:00+09:00,2025-10-05T19:00:00+09:00
05-10-2025,Kondo OO,28,5,67,99,NULL,日本語メモあり,OUT-BOUND,配送遅延 / Delivery delay,Transfer to L2,16:39:00,16:50
10/05/2025,ITO F,39,424,72 %,83,97,"customer requested callback, 日本語メモあり",OUT-BOUND,その他 / Other,エスカレーション,NULL,NULL
2025年10月05日,Ikeda X,,448,86,97 %,91,クレーム傾向あり,発信 ,技術サポート / Tech support,解決済み / Resolved,2025/10/05 19:59,20:07
10/05/2025, Saito T ,31,5,89,92,NULL,"needs coaching, 新人対応",inbound ,支払いエラー / Payment error,コールバック予定,15:02:00,15:22
05-10-2025,Ikeda X,31,5,94,97,89 %,N/A,メール,配送遅延 / Delivery delay,Resolved,2025/10/05 09:57,2025-10-05T10:05:00+09:00
2025/10/05,Kondo OO,17,414,91 %,99,98,クレーム傾向あり,受電 ,アカウント / Account,エスカレーション,17:49,2025-10-05T17:57:00+09:00
05-10-2025,Kimura Q,30,491,86,82,96,"VIP customer
クレーム傾向あり
manual check required",Outbound,キャンセル / Cancellation,Transfer to L2,19:08:00,2025-10-05T19:16:00+09:00
2025年10月05日,SHIMIZU S,36,453,98 %,79,90,,inbound ,キャンセル / Cancellation,Partially Resolved,21:34,2025/10/05 21:38
2025/10/05,ROMAN P,28,7200,91,88,91,manual check required,チャット,返品 / Return,Partially Resolved,NULL,NULL
05-10-2025,スズキ,３４,315,86,79,NUL,"manual check required, ※手動で確認, 新人対応",受電 ,配送遅延 / Delivery delay,Resolved,2025-10-05T21:45:00+09:00,21:58
2025/10/05,Aoki HH,15,519,98,98 %,95,日本語メモあり,チャット,アカウント / Account,Resolved,NULL,NULL
2025年10月05日,Endo GG,42,7200,77,NULL,NULL,"クレーム傾向あり
日本語メモあり
manual check required",Outbound,アカウント / Account,Resolved,12:34,2025-10-05T12:50:00+09:00
05-10-2025,Matsumoto O,１５,NUL,69,86,93 %,"日本語メモあり
manual check required
customer requested callback",発信 ,技術サポート / Tech support,Resolved,14:59:00,2025-10-05T15:18:00+09:00
10/05/2025,Yamamoto G,11,249,83,99,98,"urgent
needs coaching
日本語メモあり",発信 ,アカウント / Account,Resolved,13:13,13:27
2025-10-05T00:00:00+09:00,スズキ,26,NUL,68,95,89,"N/A, urgent",Outbound,支払いエラー / Payment error,一次対応のみ,18:04:00,18:13
2025/10/05, Maria R ,30,NUL,79,86,95,"needs coaching, urgent, manual check required",メール,請求 / Billing,Partially Resolved,2025-10-05T13:46:00+09:00,2025/10/05 13:51
2025/10/05,miyazaki jj,12,456,79,87,NULL,manual check required,発信 ,請求 / Billing,Unresolved,16:10,2025/10/05 16:18
2025-10-05T00:00:00,Murakami EE,41,299 sec,88,79 %,89,"※手動で確認, customer requested callback, クレーム傾向あり",受電,アカウント / Account,Transfer to L2,18:41,2025/10/05 18:46
2025年10月05日,Murakami EE,40,7200,93,NUL,91,manual check required,チャット,支払いエラー / Payment error,エスカレーション,2025/10/05 19:30,2025-10-05T19:48:00+09:00
2025-10-05T00:00:00,ROMAN P,NUL,２４８,68,94,88,weird spike,発信,その他 / Other,Unresolved,12:53,13:09:00
05-10-2025,Maeda BB,39,5,73 %,94,90,,受電 ,支払いエラー / Payment error,Resolved,2025-10-05T16:42:00+09:00,2025/10/05 16:49
10/05/2025,Endo GG,12,590,71,85,96,customer requested callback,受電 ,技術サポート / Tech support,コールバック予定,2025/10/05 19:13,19:26:00
2025/10/05,Kondo OO,33,383,95,93,99,VIP customer,OUT-BOUND,支払いエラー / Payment error,Partially Resolved,2025-10-05T17:25:00+09:00,17:38
05-10-2025,Kimura Q,,5,NULL,91 %,93 %,,受電,アカウント / Account,一次対応のみ,2025/10/05 20:38,2025/10/05 20:42
2025-10-05T00:00:00+09:00,ワタナベ,43,7200,98,99 %,88,,受電,配送遅延 / Delivery delay,コールバック予定,2025-10-05T15:37:00+09:00,2025-10-05T15:46:00+09:00
2025年10月05日,Ishikawa Z,45,597,150,86,96,"クレーム傾向あり
customer requested callback",発信,アカウント / Account,エスカレーション,2025/10/05 21:15,2025-10-05T21:28:00+09:00
2025-10-05T00:00:00, Mori V ,34,526,87,,91,"needs coaching, クレーム傾向あり",発信,配送遅延 / Delivery delay,Transfer to L2,12:57,2025/10/05 13:08
2025-10-05T00:00:00+09:00,サトウ,25,283,71 %,NUL,95,新人対応,チャット,その他 / Other,一次対応のみ,16:11,2025-10-05T16:30:00+09:00
10/06/2025,Endo GG,４４,531,NULL,８８,97,クレーム傾向あり,メール,その他 / Other,Transfer to L2,14:11:00,14:29:00
2025年10月06日,Sakamoto II,18,596 sec,80,84,100 %,manual check required,チャット,その他 / Other,一次対応のみ,2025-10-06T13:35:00+09:00,13:39
10/06/2025,Kondo OO,16,364,87 %,99,98,,チャット,その他 / Other,エスカレーション,10:24,10:36:00
06-10-2025,Aoki HH,35,5,150,87,95,"新人対応
QA to review
urgent",inbound ,請求 / Billing,Partially Resolved,2025-10-06T19:16:00+09:00,2025-10-06T19:21:00+09:00
2025/10/06, Mori V ,NULL,４４８,74 %,90,98,,inbound ,配送遅延 / Delivery delay,Transfer to L2,16:29,16:49
2025/10/06,Sofia V,37,338,70,８６,100,VIP customer,発信,キャンセル / Cancellation,解決済み / Resolved,21:27:00,21:39
2025/10/06,Aoki HH,25,379,NUL,94,98,"QA to review, weird spike",OUT-BOUND,請求 / Billing,一次対応のみ,2025/10/06 10:40,10:57
2025-10-06T00:00:00,Goto NN,４４,324,79 %,,94,"VIP customer
日本語メモあり",OUT-BOUND,技術サポート / Tech support,一次対応のみ,21:25:00,2025/10/06 21:30
2025-10-06T00:00:00,ワタナベ,25,３０６,71,93,９０,"needs coaching, ※手動で確認, 新人対応",Outbound,配送遅延 / Delivery delay,解決済み / Resolved,2025-10-06T19:13:00+09:00,19:19
2025/10/06,TAKAHASHI C,NUL,184,74,NULL,89,"日本語メモあり, double break?, N/A",受電 ,支払いエラー / Payment error,Unresolved,16:14:00,2025/10/06 16:27
2025-10-06T00:00:00+09:00,Suzuki B,,550,93,93,99,"urgent
needs coaching
クレーム傾向あり",メール,キャンセル / Cancellation,Transfer to L2,2025-10-06T16:00:00+09:00,16:19:00
2025/10/06,miyazaki jj,14,378,74,98,88,needs coaching,Inbound,技術サポート / Tech support,コールバック予定,2025-10-06T19:31:00+09:00,19:50:00
2025/10/06,NAKAJIMA AA,10,431,68,91,NUL,"日本語メモあり, VIP customer, needs coaching",Inbound,返品 / Return,Resolved,10:46,10:56
06-10-2025,Ishikawa Z,16,525,75,94,95,"N/A, QA to review",受電,配送遅延 / Delivery delay,Partially Resolved,18:34:00,18:43:00
10/06/2025,Emily T,10,485 sec,NULL,78,88,"クレーム傾向あり, double break?, customer requested callback",OUT-BOUND,支払いエラー / Payment error,解決済み / Resolved,16:22,16:29
2025年10月06日,Kondo OO,NULL,291,76,100,92 %,"needs coaching, 日本語メモあり",チャット,配送遅延 / Delivery delay,コールバック予定,2025-10-06T15:59:00+09:00,2025/10/06 16:05
2025年10月06日,Kobayashi I,30,NULL,79,90,89,N/A,発信 ,技術サポート / Tech support,コールバック予定,13:05,13:20
2025/10/06, Mori V ,35,NUL,98,NUL,93,,受電,アカウント / Account,Transfer to L2,14:12:00,14:25
2025/10/06,Murakami EE,38,598,150,NULL,91,"日本語メモあり, N/A",Inbound,キャンセル / Cancellation,エスカレーション,16:01,16:14:00
10/06/2025,Ishikawa Z,19,372,,87,９５,"manual check required
double break?",Inbound,技術サポート / Tech support,一次対応のみ,2025-10-06T19:24:00+09:00,19:34:00
2025/10/06, Abe W ,21,４６７,98,83 %,93,"※手動で確認
日本語メモあり
manual check required",受電,技術サポート / Tech support,一次対応のみ,2025-10-06T12:09:00+09:00,2025/10/06 12:22
06-10-2025,Endo GG,24,398,99 %,96,92,"double break?, urgent",発信 ,請求 / Billing,Transfer to L2,10:35:00,10:55
2025-10-06T00:00:00,Suzuki B,36,561,82,82,92,manual check required,Inbound,その他 / Other,Unresolved,2025/10/06 17:54,2025/10/06 18:12
2025-10-06T00:00:00+09:00, Mori V ,２４,187,77,NUL,95,"weird spike, QA to review",inbound ,アカウント / Account,Transfer to L2,2025-10-06T15:39:00+09:00,2025-10-06T15:59:00+09:00
10/06/2025,Emily T,12,455,98,84,92,VIP customer,OUT-BOUND,その他 / Other,エスカレーション,10:46,2025/10/06 11:05
2025年10月06日,Aoki HH,21,２８３,75,81,NULL,"double break?, クレーム傾向あり, customer requested callback",受電,アカウント / Account,解決済み / Resolved,21:10,21:23
2025-10-06T00:00:00+09:00,Miyazaki JJ,13,573,150,78,９５,weird spike,発信,その他 / Other,コールバック予定,16:05,2025-10-06T16:08:00+09:00
2025-10-06T00:00:00+09:00,スズキ,NULL,254,84,NULL,NULL,manual check required,発信 ,請求 / Billing,エスカレーション,20:37:00,20:51:00
10/06/2025,Noah W,37,5,72,94,88,新人対応,発信 ,キャンセル / Cancellation,コールバック予定,18:54:00,19:07
2025/10/06,Fujii MM,41,NUL,83,,,VIP customer,発信 ,アカウント / Account,コールバック予定,2025-10-06T09:21:00+09:00,09:35
2025年10月07日,Sasaki M,14,345,90,78,98,,OUT-BOUND,その他 / Other,Unresolved,2025/10/07 19:29,2025-10-07T19:49:00+09:00
2025年10月07日,Endo GG,30,7200,86,89 %,88,customer requested callback,OUT-BOUND,支払いエラー / Payment error,一次対応のみ,2025-10-07T20:54:00+09:00,2025/10/07 21:07
2025年10月07日,ROMAN P,29,２３７,70,,96,"※手動で確認, N/A, urgent",Inbound,請求 / Billing,Partially Resolved,2025-10-07T20:02:00+09:00,2025-10-07T20:19:00+09:00
2025-10-07T00:00:00, Kato J ,15,232,84,84,95,,Inbound,技術サポート / Tech support,Resolved,12:34:00,12:48
2025-10-07T00:00:00,Maeda BB,31,5,,79,90,"VIP customer
新人対応
customer requested callback",チャット,返品 / Return,Resolved,2025/10/07 21:48,2025-10-07T22:05:00+09:00
2025年10月07日,Matsumoto O,39,253,90,88,88 %,,発信,その他 / Other,Unresolved,2025-10-07T13:49:00+09:00,2025/10/07 14:03
2025-10-07T00:00:00,kondo ff,14,385,75,88,94,manual check required,発信 ,その他 / Other,Resolved,2025/10/07 18:38,18:55
10/07/2025, Kato J ,NULL,NULL,89,79 %,97,,OUT-BOUND,請求 / Billing,エスカレーション,17:18,17:33:00
2025/10/07, Kato J ,29,547,NUL,,94,,受電 ,技術サポート / Tech support,解決済み / Resolved,2025-10-07T20:35:00+09:00,20:49
07-10-2025,nakamura h,30,402,77,89,９８,VIP customer,受電,請求 / Billing,Resolved,2025/10/07 11:41,11:57
2025/10/07,Matsumoto O,38,397,80,９５,,"needs coaching, customer requested callback",Inbound,請求 / Billing,一次対応のみ,16:33,2025/10/07 16:38
07-10-2025,タナカ,14,４７６,65,93,100,"VIP customer
※手動で確認
customer requested callback",発信,請求 / Billing,解決済み / Resolved,2025-10-07T19:18:00+09:00,19:21:00
2025-10-07T00:00:00+09:00,Kondo OO,27,7200,NULL,96,90,"日本語メモあり, N/A, needs coaching",発信 ,請求 / Billing,エスカレーション,21:26,21:41
07-10-2025, Maria R ,13,239 sec,95,95,92,,発信,アカウント / Account,Transfer to L2,17:43:00,2025/10/07 17:47
07-10-2025,Fujii MM,31,310,80,84,93,QA to review,Inbound,その他 / Other,Transfer to L2,NULL,NULL
2025-10-07T00:00:00,Fujii MM,NULL,291,72 %,90,90,,発信,支払いエラー / Payment error,エスカレーション,13:49:00,14:05:00
2025-10-07T00:00:00,Maeda BB,13,210,150 %,84,90,新人対応,Inbound,技術サポート / Tech support,Resolved,NULL,NULL
2025-10-07T00:00:00+09:00, Abe W ,10,316,65,93,100,,発信,支払いエラー / Payment error,Transfer to L2,2025-10-07T14:43:00+09:00,14:55:00
2025年10月07日, Yamaguchi N ,NULL,572,89,90,89,,inbound ,返品 / Return,解決済み / Resolved,NULL,NULL
07-10-2025, Yamaguchi N ,44,188 sec,NUL,79,96,VIP customer,Inbound,技術サポート / Tech support,Unresolved,2025-10-07T16:41:00+09:00,16:44
07-10-2025,Sasaki M,NUL,NUL,,81,89,double break?,チャット,アカウント / Account,Transfer to L2,10:43,2025-10-07T11:03:00+09:00
2025-10-07T00:00:00+09:00,Sofia V,17,266,67 %,98,,日本語メモあり,Inbound,キャンセル / Cancellation,コールバック予定,20:51:00,2025/10/07 21:09
2025-10-07T00:00:00+09:00,Aoki HH,12,493,87,84,NULL,"クレーム傾向あり, weird spike, 新人対応",Outbound,キャンセル / Cancellation,解決済み / Resolved,2025/10/07 12:07,2025/10/07 12:14
2025-10-07T00:00:00+09:00,スズキ,１２,287,94 %,95,89 %,,発信,配送遅延 / Delivery delay,コールバック予定,12:47,2025-10-07T13:00:00+09:00
07-10-2025,ROMAN P,22,４２１,78,90,93,,発信 ,技術サポート / Tech support,一次対応のみ,11:07:00,11:24
2025/10/07,Yamamoto G,20,297 sec,96,93,99,customer requested callback,発信 ,技術サポート / Tech support,コールバック予定,2025/10/07 09:02,2025/10/07 09:20
07-10-2025, Mori V ,38,5,91,87,,VIP customer,発信 ,技術サポート / Tech support,エスカレーション,16:49:00,2025/10/07 16:56
07-10-2025,kondo ff,,377,,86,91,"日本語メモあり
クレーム傾向あり
manual check required",inbound ,支払いエラー / Payment error,コールバック予定,2025-10-07T14:29:00+09:00,14:33
2025年10月07日,ハヤシ,17,565,79,94,NUL,"クレーム傾向あり, double break?",発信,キャンセル / Cancellation,エスカレーション,2025-10-07T18:23:00+09:00,2025-10-07T18:28:00+09:00
2025-10-07T00:00:00+09:00,Sakamoto II,14,536,66,95,99,,Outbound,配送遅延 / Delivery delay,コールバック予定,2025/10/07 18:21,2025/10/07 18:34
2025/10/08, Kato J ,NUL,267,83,,95,,受電 ,キャンセル / Cancellation,Unresolved,11:53:00,12:00
2025年10月08日,Emily T,23,7200,87 %,83,,新人対応,OUT-BOUND,技術サポート / Tech support,Transfer to L2,19:45,2025/10/08 19:57
08-10-2025,john s,NUL,200,90,89 %,NUL,"クレーム傾向あり
weird spike
※手動で確認",Inbound,その他 / Other,Resolved,2025-10-08T17:25:00+09:00,17:34:00
2025-10-08T00:00:00+09:00,Sakamoto II,37,325,100 %,92,90,"urgent, customer requested callback",OUT-BOUND,返品 / Return,一次対応のみ,NULL,NULL
10/08/2025,Sofia V,NULL,319,73,８７,97,double break?,メール,キャンセル / Cancellation,エスカレーション,10:41,2025-10-08T10:53:00+09:00
2025年10月08日,ITO F,14,426,95,89,90,"urgent
N/A
double break?",チャット,アカウント / Account,Transfer to L2,09:18,09:30
2025-10-08T00:00:00,SHIMIZU S,20,530,88 %,82 %,93,needs coaching,受電 ,返品 / Return,Partially Resolved,2025-10-08T21:57:00+09:00,2025/10/08 22:17
2025-10-08T00:00:00,Matsumoto O,NUL,NULL,,100,97,,メール,技術サポート / Tech support,Resolved,12:08,12:15
10/08/2025,Alex Q,１７,567,,96 %,92 %,double break?,Inbound,返品 / Return,Partially Resolved,,
08-10-2025,Miyazaki JJ,32,579,71,94,100,,Outbound,その他 / Other,Transfer to L2,20:37,20:45:00
10/08/2025,Kimura Q,24,340,NULL,100,NULL,"※手動で確認, 新人対応",メール,その他 / Other,Partially Resolved,2025-10-08T17:26:00+09:00,2025/10/08 17:38
2025年10月08日,WATANABE E,41,４４７,NULL,96,90 %,"weird spike, customer requested callback",受電,支払いエラー / Payment error,Partially Resolved,15:46:00,2025/10/08 16:04
10/08/2025,Murakami EE,35,255,96,78 %,NUL,,inbound ,請求 / Billing,コールバック予定,2025-10-08T18:43:00+09:00,2025-10-08T18:56:00+09:00
2025/10/08,HASEGAWA KK,39,431,99,79,95,urgent,メール,請求 / Billing,エスカレーション,2025-10-08T15:08:00+09:00,2025/10/08 15:20
2025/10/08,HASEGAWA KK,40,439 sec,89,８７,,"double break?, VIP customer",チャット,アカウント / Account,Resolved,NULL,NULL
2025-10-08T00:00:00+09:00,ROMAN P,29,213,150,,94,,発信,技術サポート / Tech support,Transfer to L2,2025/10/08 15:36,2025-10-08T15:51:00+09:00
08-10-2025,Sasaki M,41,353,77,80,88,"VIP customer
needs coaching
customer requested callback",チャット,キャンセル / Cancellation,Resolved,2025-10-08T18:51:00+09:00,19:10:00
2025年10月08日,Hayashi R,44,308,76,94,99,"double break?, QA to review, customer requested callback",inbound ,返品 / Return,Transfer to L2,16:09:00,2025/10/08 16:19
2025年10月08日,Aoki HH,14,316,80,84 %,92,"日本語メモあり
weird spike
urgent",inbound ,キャンセル / Cancellation,一次対応のみ,NULL,NULL
10/08/2025,Suzuki B,13,5,69,89,99,"needs coaching, クレーム傾向あり, manual check required",受電 ,キャンセル / Cancellation,エスカレーション,2025/10/08 10:15,10:21
2025-10-08T00:00:00+09:00,nakamura h,NUL,NUL,93,79,93,,メール,請求 / Billing,Transfer to L2,NULL,NULL
2025-10-08T00:00:00,Okada LL,13,302,88,95,94,※手動で確認,OUT-BOUND,その他 / Other,Transfer to L2,2025-10-08T21:49:00+09:00,2025/10/08 22:05
08-10-2025, Mori V ,31,599,69,95,,,OUT-BOUND,その他 / Other,Unresolved,2025-10-08T09:25:00+09:00,2025-10-08T09:34:00+09:00
2025-10-08T00:00:00+09:00,Maeda BB,18,585,73,88,90,"weird spike, 日本語メモあり, VIP customer",発信 ,返品 / Return,Resolved,2025/10/08 16:12,2025/10/08 16:23
2025年10月08日,Okada LL,NUL,267,92,99,100,"weird spike
customer requested callback",メール,返品 / Return,コールバック予定,,
2025-10-08T00:00:00+09:00,Kondo OO,25,414 sec,85,84,92 %,N/A,発信,配送遅延 / Delivery delay,解決済み / Resolved,2025/10/08 09:16,09:35:00
2025/10/08,ハヤシ,,NUL,150,92,90,"※手動で確認
VIP customer",受電,キャンセル / Cancellation,一次対応のみ,18:53,19:04:00
10/08/2025,サトウ,19,５０５,NULL,79,89,,チャット,その他 / Other,エスカレーション,16:07:00,16:14
08-10-2025,Maeda BB,27,288,76,NUL,98 %,"manual check required
double break?",チャット,支払いエラー / Payment error,Transfer to L2,2025/10/08 11:01,2025/10/08 11:06
2025年10月08日,タナカ,10,7200,93,96,92,,発信 ,アカウント / Account,Resolved,2025/10/08 15:16,2025-10-08T15:24:00+09:00
2025-10-09T00:00:00+09:00,INOUE P,35,514,84,89,95,,発信 ,アカウント / Account,Resolved,2025/10/09 21:27,2025-10-09T21:41:00+09:00
2025/10/09,ヤマダ,39,545,98 %,80,90,,受電,キャンセル / Cancellation,解決済み / Resolved,2025/10/09 17:04,2025-10-09T17:08:00+09:00
09-10-2025,Matsumoto O,26,573,76,79 %,92,"customer requested callback
※手動で確認",OUT-BOUND,返品 / Return,Unresolved,2025-10-09T10:47:00+09:00,2025-10-09T10:58:00+09:00
2025-10-09T00:00:00,Sakamoto II,,415,96,97,94,,Outbound,支払いエラー / Payment error,解決済み / Resolved,20:12,2025/10/09 20:15
2025/10/09,タナカ,29,NULL,72,100,,weird spike,受電,技術サポート / Tech support,Transfer to L2,09:06:00,2025-10-09T09:22:00+09:00
10/09/2025, Abe W ,41,5,,95 %,94,"N/A
新人対応
QA to review",メール,返品 / Return,エスカレーション,14:28:00,2025/10/09 14:38
2025年10月09日,ハヤシ,34,524,75,80,97,"※手動で確認
weird spike",inbound ,技術サポート / Tech support,Transfer to L2,2025-10-09T13:22:00+09:00,2025-10-09T13:30:00+09:00
10/09/2025,john s,NUL,467,87,95,96,,発信,その他 / Other,Resolved,NULL,NULL
2025-10-09T00:00:00+09:00,Ogawa DD,23,NUL,93,81,89,weird spike,発信,配送遅延 / Delivery delay,一次対応のみ,2025/10/09 17:10,17:15:00
09-10-2025,タナカ,43,590,98,78,96,QA to review,inbound ,請求 / Billing,解決済み / Resolved,19:45:00,20:04:00
2025-10-09T00:00:00,Murakami EE,43,NULL,78,97,100,日本語メモあり,受電,請求 / Billing,一次対応のみ,12:05,2025-10-09T12:24:00+09:00
2025/10/09,INOUE P,25,396,NUL,98,89,,チャット,返品 / Return,Partially Resolved,14:19,2025/10/09 14:31
09-10-2025,Endo GG,30,NUL,94 %,91 %,NUL,"weird spike
新人対応",受電 ,アカウント / Account,コールバック予定,2025/10/09 13:37,2025/10/09 13:55
2025-10-09T00:00:00+09:00,Maeda BB,41,NULL,98 %,93 %,96,"needs coaching
double break?",メール,技術サポート / Tech support,Unresolved,2025/10/09 10:23,2025-10-09T10:35:00+09:00
2025-10-09T00:00:00+09:00,Miyazaki JJ,３６,325,72,NUL,,"customer requested callback, 新人対応",受電,その他 / Other,Unresolved,2025/10/09 21:08,21:27
2025年10月09日,Suzuki B,NULL,499,99 %,92,99 %,"※手動で確認
クレーム傾向あり
manual check required",受電 ,支払いエラー / Payment error,Partially Resolved,2025/10/09 18:34,2025-10-09T18:38:00+09:00
09-10-2025,ITO F,21,285,93 %,８８,88,,受電 ,配送遅延 / Delivery delay,コールバック予定,13:05:00,13:11
2025年10月09日,スズキ,19,266 sec,76 %,NUL,93,,Inbound,技術サポート / Tech support,Partially Resolved,2025/10/09 12:48,2025-10-09T12:58:00+09:00
2025-10-09T00:00:00,TAKAHASHI C,45,388,,96,100,"クレーム傾向あり
weird spike
urgent",OUT-BOUND,返品 / Return,コールバック予定,,
2025/10/09,Matsumoto O,２０,426,87,94,89,,OUT-BOUND,キャンセル / Cancellation,コールバック予定,12:39:00,12:58:00
09-10-2025,SHIMIZU S,25,287,,98,,,OUT-BOUND,アカウント / Account,エスカレーション,2025-10-09T21:25:00+09:00,2025-10-09T21:45:00+09:00
10/09/2025,HASEGAWA KK,32,487,65 %,84,,,チャット,返品 / Return,Resolved,2025/10/09 18:40,18:52:00
2025年10月09日,ヤマダ,２３,506,96,96,97,,発信 ,返品 / Return,一次対応のみ,12:54:00,2025/10/09 12:57
10/09/2025,ワタナベ,13,388,88,,88,QA to review,Inbound,技術サポート / Tech support,Partially Resolved,20:27:00,20:32:00
09-10-2025, Saito T ,11,483,80 %,88,91,manual check required,Inbound,支払いエラー / Payment error,解決済み / Resolved,09:24,2025-10-09T09:37:00+09:00
2025-10-09T00:00:00,Emily T,３７,466 sec,90 %,85,95,"needs coaching, N/A, manual check required",inbound ,その他 / Other,Transfer to L2,2025-10-09T18:12:00+09:00,18:18
2025-10-09T00:00:00+09:00, Maria R ,26,497,68 %,94,96,"※手動で確認, N/A",受電 ,請求 / Billing,解決済み / Resolved,12:32,12:52
2025-10-09T00:00:00+09:00,タナカ,31,534,86,83,９５,,Outbound,その他 / Other,Partially Resolved,2025/10/09 12:30,12:43
2025年10月09日,ワタナベ,,464,150,79,91,"weird spike
urgent
double break?",メール,支払いエラー / Payment error,解決済み / Resolved,19:08:00,19:23
10/09/2025, Kato J ,33,589,69 %,82,93,double break?,Outbound,キャンセル / Cancellation,Unresolved,14:15,2025/10/09 14:19
10-10-2025,FUJITA CC,NULL,519,97,83,99,"double break?
customer requested callback
manual check required",Outbound,返品 / Return,エスカレーション,12:25,12:34:00
2025/10/10,Kondo OO,NULL,331,94,92,９３,"manual check required
needs coaching",Inbound,キャンセル / Cancellation,Resolved,NULL,NULL
2025/10/10,ヤマダ,22,561,73,９５,93,"double break?, manual check required, 日本語メモあり",受電 ,請求 / Billing,コールバック予定,2025/10/10 12:14,2025/10/10 12:23
2025-10-10T00:00:00,john s,22,393,88 %,８７,93,"double break?, VIP customer",チャット,技術サポート / Tech support,解決済み / Resolved,2025/10/10 11:09,2025/10/10 11:22
10/10/2025,FUJITA CC,NULL,423,84 %,NULL,88,,Outbound,支払いエラー / Payment error,コールバック予定,2025/10/10 13:13,2025-10-10T13:23:00+09:00
2025/10/10,Noah W,,390,NULL,80,91,customer requested callback,メール,返品 / Return,エスカレーション,2025/10/10 13:12,13:15
2025年10月10日,Endo GG,41,557 sec,94,87,94,"QA to review
manual check required",発信 ,支払いエラー / Payment error,コールバック予定,20:02:00,2025-10-10T20:12:00+09:00
10-10-2025,Sasaki M,23,570,NUL,NULL,93,,inbound ,その他 / Other,解決済み / Resolved,10:40,2025/10/10 10:57
2025-10-10T00:00:00,ヤマダ,18,４２８,93 %,８３,NULL,,受電 ,アカウント / Account,Unresolved,10:42:00,10:45
10-10-2025,FUJITA CC,,２９０,98,81,NUL,,受電,返品 / Return,Partially Resolved,NULL,NULL
2025-10-10T00:00:00,INOUE P,22,5,71,８３,93,"QA to review
double break?
needs coaching",Inbound,配送遅延 / Delivery delay,Transfer to L2,NULL,NULL
10/10/2025,FUJITA CC,27,214,96,NULL,97,"VIP customer, QA to review, manual check required",OUT-BOUND,配送遅延 / Delivery delay,Unresolved,2025-10-10T19:48:00+09:00,20:01:00
2025/10/10,INOUE P,38,299,,,89,"needs coaching
日本語メモあり
urgent",メール,返品 / Return,Unresolved,2025/10/10 15:13,15:17:00
2025年10月10日,ハヤシ,12,511,86,79,98,"N/A, urgent, 新人対応",Inbound,その他 / Other,Resolved,12:03,12:10
2025/10/10,ROMAN P,NULL,339,80,98,93,"customer requested callback, VIP customer, QA to review",発信,技術サポート / Tech support,コールバック予定,15:54,15:59
10/10/2025,Kondo OO,39,426 sec,NULL,８２,99,"VIP customer
N/A",メール,支払いエラー / Payment error,コールバック予定,09:58,2025/10/10 10:04
10-10-2025,Kondo OO,41,209,80,89,98,※手動で確認,発信 ,請求 / Billing,解決済み / Resolved,2025/10/10 10:49,2025-10-10T10:54:00+09:00
2025-10-10T00:00:00+09:00,Endo GG,20,334,84,80,90,"※手動で確認, 日本語メモあり, urgent",inbound ,支払いエラー / Payment error,Resolved,2025/10/10 21:44,22:00
2025年10月10日,スズキ,18,NUL,93,84 %,100,"manual check required
customer requested callback",OUT-BOUND,支払いエラー / Payment error,一次対応のみ,10:24,2025/10/10 10:30
10-10-2025, Abe W ,１０,183,,78,92,"N/A, double break?",チャット,配送遅延 / Delivery delay,Partially Resolved,NULL,NULL
2025年10月10日,Murakami EE,10,551,,94,93,"QA to review
manual check required
weird spike",チャット,技術サポート / Tech support,Transfer to L2,2025/10/10 09:51,2025/10/10 10:04
2025/10/10,サトウ,32,423,89,82,99,"manual check required, クレーム傾向あり",発信,請求 / Billing,エスカレーション,2025-10-10T10:30:00+09:00,2025-10-10T10:50:00+09:00
10-10-2025,nakamura h,,347,81,99,99,customer requested callback,発信 ,支払いエラー / Payment error,Transfer to L2,2025/10/10 15:58,16:13
2025年10月10日,NAKAJIMA AA,NUL,5,NUL,84,93,,inbound ,返品 / Return,コールバック予定,15:20,15:34
10/10/2025,Ogawa DD,,341,96,87,99 %,"VIP customer, needs coaching, ※手動で確認",発信 ,その他 / Other,Partially Resolved,16:18,16:33
2025-10-10T00:00:00+09:00,Suzuki B,13,429,75,88,94,,Outbound,アカウント / Account,Resolved,2025/10/10 11:20,11:24
2025-10-10T00:00:00+09:00, Maria R ,40,NULL,77,,97,"QA to review, manual check required",inbound ,支払いエラー / Payment error,Transfer to L2,16:11:00,2025/10/10 16:15
10-10-2025,Miyazaki JJ,２５,430,150,99,98,needs coaching,Inbound,その他 / Other,Partially Resolved,09:37,2025/10/10 09:55
10-10-2025, Mori V ,29,5,NUL,95,,"double break?
クレーム傾向あり
新人対応",発信 ,支払いエラー / Payment error,Partially Resolved,19:57,2025-10-10T20:03:00+09:00
10/10/2025,Ishikawa Z,１７,514,67 %,87,98 %,"double break?, ※手動で確認, manual check required",OUT-BOUND,その他 / Other,Transfer to L2,2025-10-10T17:58:00+09:00,2025-10-10T18:12:00+09:00
2025-10-11T00:00:00,ROMAN P,29,248,73,95,94,"urgent
クレーム傾向あり
weird spike",メール,返品 / Return,Transfer to L2,18:42,19:01:00
10/11/2025,nakamura h,,219,91 %,89,１００,QA to review,Inbound,請求 / Billing,一次対応のみ,18:52:00,19:10:00
2025-10-11T00:00:00,Okada LL,20,272,99,90,,manual check required,受電,キャンセル / Cancellation,解決済み / Resolved,2025/10/11 20:40,2025/10/11 20:54
10/11/2025,スズキ,39,399,79,87,NULL,,Outbound,支払いエラー / Payment error,Unresolved,2025/10/11 18:03,2025-10-11T18:08:00+09:00
11-10-2025,nakamura h,18,526,77,100,99,"manual check required, customer requested callback, 日本語メモあり",OUT-BOUND,返品 / Return,Unresolved,2025/10/11 10:23,2025/10/11 10:30
2025-10-11T00:00:00+09:00,Kimura Q,17,456,95,98,98,"新人対応
日本語メモあり
N/A",発信,配送遅延 / Delivery delay,一次対応のみ,2025/10/11 14:06,14:09:00
2025-10-11T00:00:00,ワタナベ,２２,258,,86,94,,発信,その他 / Other,Unresolved,,
2025-10-11T00:00:00+09:00,kondo ff,NUL,248,75,99,95,"クレーム傾向あり, VIP customer",受電,請求 / Billing,Resolved,2025-10-11T10:50:00+09:00,10:53
11-10-2025,Kobayashi I,37,402,NUL,97,100,"QA to review, weird spike, 新人対応",Inbound,請求 / Billing,Partially Resolved,2025-10-11T18:40:00+09:00,18:47:00
2025-10-11T00:00:00+09:00,Yamazaki U,２２,5,84,85,98 %,,チャット,キャンセル / Cancellation,Transfer to L2,NULL,NULL
2025-10-11T00:00:00,ヤマダ,NULL,288,92,89,98,"double break?, N/A, customer requested callback",チャット,返品 / Return,一次対応のみ,2025-10-11T12:37:00+09:00,2025-10-11T12:52:00+09:00
11-10-2025,Sofia V,22,218,95,82 %,96,"N/A, double break?, 新人対応",Inbound,アカウント / Account,Resolved,2025-10-11T16:26:00+09:00,16:45
2025年10月11日,Okada LL,18,211,90,94,94,urgent,発信 ,返品 / Return,解決済み / Resolved,21:32:00,21:49:00
2025年10月11日,NAKAJIMA AA,45,４５３,NULL,82,91,,チャット,配送遅延 / Delivery delay,Transfer to L2,10:45:00,11:05:00
11-10-2025,Kobayashi I,32,２７０,71,98,91,,発信 ,アカウント / Account,Unresolved,2025-10-11T16:14:00+09:00,2025/10/11 16:30
10/11/2025,スズキ,21,553,76,84 %,NUL,,受電,支払いエラー / Payment error,Unresolved,2025-10-11T20:48:00+09:00,2025-10-11T20:51:00+09:00
11-10-2025,ワタナベ,18,5,NULL,７８,96,urgent,発信 ,その他 / Other,Unresolved,NULL,NULL
2025年10月11日,Sasaki M,１７,7200,71,82 %,91,manual check required,Inbound,その他 / Other,Unresolved,2025-10-11T10:14:00+09:00,10:20:00
2025年10月11日,ITO F,15,271,150,99,89,"double break?, VIP customer",inbound ,請求 / Billing,Unresolved,2025/10/11 14:09,2025-10-11T14:24:00+09:00
2025/10/11,ITO F,27,245,92,97,98,"クレーム傾向あり, 新人対応, double break?",Outbound,アカウント / Account,Resolved,18:45,2025-10-11T19:01:00+09:00
2025年10月11日,ROMAN P,,188,NULL,89,90,"weird spike, double break?",inbound ,請求 / Billing,Resolved,NULL,NULL
2025年10月11日,nakamura h,NULL,NULL,95,78,88,,OUT-BOUND,その他 / Other,Unresolved,2025/10/11 20:33,2025-10-11T20:45:00+09:00
2025-10-11T00:00:00,Yamamoto G,12,NUL,150,92,96,"needs coaching
クレーム傾向あり",OUT-BOUND,返品 / Return,コールバック予定,2025-10-11T18:03:00+09:00,2025/10/11 18:13
2025年10月11日, Mori V ,35,NUL,92,NULL,NUL,"日本語メモあり
weird spike",受電 ,支払いエラー / Payment error,Resolved,12:38,2025-10-11T12:41:00+09:00
2025年10月11日,ROMAN P,NULL,202,,87 %,92,"VIP customer, N/A",Inbound,配送遅延 / Delivery delay,コールバック予定,2025-10-11T20:32:00+09:00,2025/10/11 20:38
2025/10/11, Mori V ,12,NUL,70,84,90,"manual check required, クレーム傾向あり, N/A",OUT-BOUND,配送遅延 / Delivery delay,一次対応のみ,,
11-10-2025,kondo ff,23,258,NUL,,92,新人対応,チャット,請求 / Billing,一次対応のみ,2025-10-11T11:04:00+09:00,11:15
10/11/2025,kondo ff,40,406,NULL,79,97,"N/A, double break?, needs coaching",受電 ,その他 / Other,一次対応のみ,2025-10-11T19:02:00+09:00,19:06
2025年10月11日,Ogawa DD,35,416,99,80,94,"N/A, customer requested callback",発信,支払いエラー / Payment error,一次対応のみ,16:02,16:22:00
2025-10-11T00:00:00, Maria R ,３４,584,NUL,99,90 %,"VIP customer, 新人対応",受電 ,返品 / Return,一次対応のみ,11:53:00,11:57:00
2025-10-12T00:00:00+09:00,Maeda BB,36,581,89,97,90,"VIP customer
double break?
N/A",発信,請求 / Billing,エスカレーション,2025/10/12 14:07,14:23
10/12/2025,タナカ,１６,276,150,84,,※手動で確認,受電 ,支払いエラー / Payment error,エスカレーション,2025/10/12 19:29,19:45:00
2025-10-12T00:00:00+09:00,ITO F,33,457,92,81,NULL,"QA to review, needs coaching, 新人対応",発信 ,支払いエラー / Payment error,エスカレーション,17:37,17:41
10/12/2025,miyazaki jj,17,243,90 %,85,92,日本語メモあり,受電,技術サポート / Tech support,解決済み / Resolved,09:09:00,09:23:00
2025/10/12,Maeda BB,25,495,92 %,83,91 %,"needs coaching, manual check required, customer requested callback",メール,請求 / Billing,Transfer to L2,,
12-10-2025,ワタナベ,１９,２２０,94,83,96,"double break?, ※手動で確認",メール,支払いエラー / Payment error,Unresolved,2025-10-12T19:01:00+09:00,2025-10-12T19:07:00+09:00
2025年10月12日,Miyazaki JJ,２１,365,NULL,91 %,89,"新人対応
urgent
VIP customer",OUT-BOUND,技術サポート / Tech support,Resolved,2025-10-12T14:22:00+09:00,14:40
12-10-2025,Endo GG,17,7200,,82,88,※手動で確認,Outbound,支払いエラー / Payment error,Transfer to L2,2025/10/12 20:35,2025/10/12 20:47
2025年10月12日,Yamazaki U,27,NULL,84,93,92,"weird spike
customer requested callback",Inbound,その他 / Other,Unresolved,09:32:00,2025/10/12 09:43
2025-10-12T00:00:00,INOUE P,30,NUL,78,88,,"customer requested callback, N/A",受電 ,支払いエラー / Payment error,コールバック予定,13:38:00,2025-10-12T13:47:00+09:00
12-10-2025, Maria R ,37,280 sec,67,81,91,"日本語メモあり
新人対応
※手動で確認",受電,技術サポート / Tech support,解決済み / Resolved,2025/10/12 14:41,14:44:00
2025年10月12日,TAKAHASHI C,３５,432,94,81,NULL,,inbound ,請求 / Billing,Resolved,14:55:00,2025-10-12T15:11:00+09:00
2025-10-12T00:00:00,Sasaki M,12,218,89,82,90,"manual check required, 新人対応",受電 ,返品 / Return,エスカレーション,19:31,2025-10-12T19:42:00+09:00
2025年10月12日,Kondo OO,32,517,69,NUL,,,受電,返品 / Return,エスカレーション,10:21:00,10:30:00
10/12/2025,kondo ff,42,NULL,89,94,NUL,"※手動で確認
customer requested callback
manual check required",発信,支払いエラー / Payment error,Resolved,NULL,NULL
2025/10/12,HASEGAWA KK,26,361,97,89 %,99,,OUT-BOUND,キャンセル / Cancellation,エスカレーション,2025-10-12T17:27:00+09:00,17:33
2025-10-12T00:00:00,ITO F,27,321,90,100,93,,inbound ,支払いエラー / Payment error,Unresolved,17:58,18:16
12-10-2025,Goto NN,NULL,NUL,74,91,89,,チャット,その他 / Other,解決済み / Resolved,NULL,NULL
2025/10/12,INOUE P,28,265,NUL,88,92,"※手動で確認
VIP customer",受電 ,その他 / Other,Resolved,NULL,NULL
2025-10-12T00:00:00+09:00,Aoki HH,19,7200,92,84,NULL,,受電 ,その他 / Other,Unresolved,2025/10/12 13:58,14:12:00
2025-10-12T00:00:00+09:00, Kato J ,,355,87,93,96,"新人対応
※手動で確認",メール,技術サポート / Tech support,エスカレーション,2025/10/12 09:13,09:25:00
10/12/2025,ワタナベ,１０,NULL,97,82,99,,Outbound,技術サポート / Tech support,エスカレーション,2025-10-12T14:15:00+09:00,14:30:00
2025/10/12, Kato J ,37,476,91,80,90,クレーム傾向あり,チャット,配送遅延 / Delivery delay,エスカレーション,2025-10-12T14:27:00+09:00,2025-10-12T14:44:00+09:00
10/12/2025,miyazaki jj,NULL,NULL,80,97,100,"double break?, クレーム傾向あり",inbound ,支払いエラー / Payment error,解決済み / Resolved,13:53:00,2025/10/12 13:59
2025年10月12日,Sasaki M,17,558,100,85,98,,発信,返品 / Return,Resolved,2025-10-12T10:00:00+09:00,10:07
2025-10-12T00:00:00,FUJITA CC,42,5,NULL,83,97,"urgent
manual check required",OUT-BOUND,返品 / Return,Unresolved,17:47:00,2025-10-12T18:07:00+09:00
10/12/2025,Sofia V,27,234,NULL,８１,98,"urgent, 新人対応",発信,キャンセル / Cancellation,解決済み / Resolved,11:22:00,2025/10/12 11:41
2025-10-12T00:00:00,Hayashi R,19,353,NULL,99,98,customer requested callback,受電 ,キャンセル / Cancellation,Unresolved,2025-10-12T20:20:00+09:00,2025-10-12T20:34:00+09:00
12-10-2025,INOUE P,16,527,80 %,90,NUL,日本語メモあり,Inbound,その他 / Other,Transfer to L2,2025/10/12 18:40,2025/10/12 18:43
12-10-2025,ハヤシ,22,527,150,84 %,,weird spike,OUT-BOUND,技術サポート / Tech support,Transfer to L2,2025/10/12 21:26,21:46
2025/10/13,FUJITA CC,42,466,89,82,91 %,weird spike,メール,キャンセル / Cancellation,コールバック予定,20:22:00,2025-10-13T20:27:00+09:00
2025/10/13, Yamaguchi N ,43,384,95,98 %,92,,Outbound,配送遅延 / Delivery delay,解決済み / Resolved,2025-10-13T12:31:00+09:00,12:36:00
10/13/2025, Saito T ,15,２４６,,98,91 %,,Outbound,アカウント / Account,解決済み / Resolved,17:30,2025/10/13 17:34
10/13/2025,Sasaki M,17,368,80,85,96,,Outbound,技術サポート / Tech support,Resolved,NULL,NULL
2025/10/13,Murakami EE,25,NULL,72,NUL,91,新人対応,チャット,キャンセル / Cancellation,Partially Resolved,2025-10-13T17:57:00+09:00,2025-10-13T18:08:00+09:00
10/13/2025,Murakami EE,41,250,100,82 %,95,,発信,技術サポート / Tech support,一次対応のみ,2025-10-13T13:37:00+09:00,13:52:00
10/13/2025,Fujii MM,34,7200,76,99,88,"double break?
customer requested callback",inbound ,配送遅延 / Delivery delay,コールバック予定,15:50:00,2025/10/13 15:54
2025/10/13,nakamura h,43,419,NULL,,92 %,,受電 ,キャンセル / Cancellation,Transfer to L2,18:25:00,2025-10-13T18:29:00+09:00
2025年10月13日,ITO F,30,407,87,84,NUL,"N/A
needs coaching
新人対応",メール,キャンセル / Cancellation,エスカレーション,2025-10-13T11:14:00+09:00,11:22
13-10-2025,ITO F,,４０５,68,86 %,９３,,Inbound,支払いエラー / Payment error,エスカレーション,10:32:00,2025/10/13 10:37
13-10-2025, Saito T ,28,583,88,97 %,92,,発信 ,返品 / Return,Transfer to L2,17:45,2025/10/13 18:04
2025-10-13T00:00:00,Sofia V,19,220,97,91,100 %,"クレーム傾向あり
新人対応
N/A",発信 ,キャンセル / Cancellation,Partially Resolved,2025-10-13T14:15:00+09:00,14:29
13-10-2025,Emily T,36,438 sec,95,91,96,"urgent, customer requested callback, ※手動で確認",チャット,配送遅延 / Delivery delay,Resolved,2025/10/13 10:26,10:42
10/13/2025,スズキ,,NULL,100,８１,99,"QA to review
double break?
N/A",受電 ,返品 / Return,一次対応のみ,2025-10-13T10:21:00+09:00,2025-10-13T10:34:00+09:00
2025年10月13日,サトウ,36,403,NULL,96,NULL,"customer requested callback, N/A, manual check required",受電,配送遅延 / Delivery delay,エスカレーション,11:32:00,2025/10/13 11:43
2025-10-13T00:00:00,john s,43,398,74 %,84,93 %,,Inbound,キャンセル / Cancellation,一次対応のみ,16:28:00,2025-10-13T16:38:00+09:00
13-10-2025,NAKAJIMA AA,16,566,,９５,88,"VIP customer, 新人対応",発信,キャンセル / Cancellation,Resolved,20:45:00,2025-10-13T20:51:00+09:00
2025年10月13日,ハヤシ,17,561,97,94,88,"weird spike, クレーム傾向あり",inbound ,技術サポート / Tech support,Partially Resolved,11:37,11:52:00
2025-10-13T00:00:00+09:00, Mori V ,21,２８１,78 %,NUL,９１,"QA to review
manual check required
customer requested callback",チャット,その他 / Other,Unresolved,2025/10/13 13:53,2025/10/13 14:03
2025年10月13日,Okada LL,２８,NULL,83,85,93,double break?,発信,アカウント / Account,Partially Resolved,2025/10/13 09:18,2025-10-13T09:29:00+09:00
2025年10月13日,Ishikawa Z,30,397,79,87,96,"customer requested callback, N/A, urgent",inbound ,技術サポート / Tech support,コールバック予定,2025-10-13T10:49:00+09:00,2025-10-13T11:02:00+09:00
2025-10-13T00:00:00+09:00,Endo GG,22,382,88,８５,,クレーム傾向あり,発信,技術サポート / Tech support,Unresolved,13:19,2025-10-13T13:22:00+09:00
13-10-2025,TAKAHASHI C,NUL,515,70 %,100,,"urgent, needs coaching, customer requested callback",Outbound,キャンセル / Cancellation,Transfer to L2,2025-10-13T15:32:00+09:00,15:35:00
2025/10/13,Ikeda X,28,388,99,93,99,"double break?, weird spike",発信,支払いエラー / Payment error,一次対応のみ,2025/10/13 14:09,14:14
2025-10-13T00:00:00+09:00,Alex Q,40,569,84,79,88,"クレーム傾向あり
新人対応",Outbound,配送遅延 / Delivery delay,エスカレーション,2025-10-13T20:30:00+09:00,2025-10-13T20:49:00+09:00
13-10-2025,nakamura h,NULL,NULL,,81,88,"新人対応, urgent, クレーム傾向あり",inbound ,キャンセル / Cancellation,Resolved,15:18:00,15:29
2025年10月13日,Miyazaki JJ,23,370,86,82,93,,inbound ,キャンセル / Cancellation,Partially Resolved,2025-10-13T12:44:00+09:00,2025/10/13 12:50
2025-10-13T00:00:00+09:00,Okada LL,NULL,２９５,150,91,94,needs coaching,Inbound,返品 / Return,一次対応のみ,2025/10/13 11:16,11:22:00
2025/10/13, Maria R ,40,7200,78 %,82,,,inbound ,請求 / Billing,エスカレーション,2025-10-13T15:42:00+09:00,16:00
10/13/2025,Ishikawa Z,34,４４７,78,86,95,,受電,配送遅延 / Delivery delay,Unresolved,09:55:00,2025/10/13 10:09
2025/10/14,FUJITA CC,22,NUL,65,84 %,89,customer requested callback,メール,その他 / Other,コールバック予定,NULL,NULL
2025-10-14T00:00:00, Maria R ,40,431,99,,,VIP customer,OUT-BOUND,支払いエラー / Payment error,コールバック予定,NULL,NULL
2025/10/14,Ogawa DD,22,350,75,89,98,"urgent
VIP customer
※手動で確認",発信,技術サポート / Tech support,一次対応のみ,2025-10-14T18:12:00+09:00,18:31:00
2025/10/14,TAKAHASHI C,31,224,NULL,NULL,90,,OUT-BOUND,技術サポート / Tech support,Partially Resolved,19:23,19:40:00
14-10-2025,WATANABE E,22,338 sec,76,91,90,新人対応,チャット,配送遅延 / Delivery delay,エスカレーション,,
10/14/2025,Sofia V,23,510,97,86 %,92,"manual check required, double break?, urgent",発信,配送遅延 / Delivery delay,Transfer to L2,18:24:00,2025-10-14T18:28:00+09:00
10/14/2025,Maeda BB,31,NULL,84,78,99,"VIP customer, N/A",発信,アカウント / Account,一次対応のみ,2025-10-14T09:59:00+09:00,2025/10/14 10:09
2025年10月14日,nakamura h,35,NUL,150,100,100,needs coaching,OUT-BOUND,配送遅延 / Delivery delay,エスカレーション,,
2025-10-14T00:00:00+09:00,Miyazaki JJ,29,NUL,92 %,99,,,Inbound,その他 / Other,コールバック予定,20:13,2025-10-14T20:31:00+09:00
2025-10-14T00:00:00+09:00,Kimura Q,18,324,90,99,97,"日本語メモあり, customer requested callback, VIP customer",Inbound,返品 / Return,Unresolved,16:12:00,2025/10/14 16:16
2025-10-14T00:00:00+09:00,Ikeda X,28,426 sec,91,94,NULL,manual check required,inbound ,請求 / Billing,Transfer to L2,2025/10/14 11:36,2025/10/14 11:55
2025-10-14T00:00:00,nakamura h,26,NULL,93,100,100,"needs coaching
urgent
日本語メモあり",発信 ,キャンセル / Cancellation,Partially Resolved,2025-10-14T17:52:00+09:00,2025-10-14T18:09:00+09:00
10/14/2025, Abe W ,33,３３１,83,,98 %,,inbound ,アカウント / Account,Partially Resolved,2025/10/14 11:05,2025/10/14 11:25
2025年10月14日,TAKAHASHI C,25,555,,79,89,,メール,アカウント / Account,コールバック予定,2025-10-14T09:11:00+09:00,2025/10/14 09:22
2025-10-14T00:00:00+09:00,ITO F,29,586,95,86,98 %,manual check required,inbound ,アカウント / Account,Partially Resolved,2025/10/14 09:50,10:06:00
2025-10-14T00:00:00+09:00,Ogawa DD,30,552,86,95 %,93,"weird spike, クレーム傾向あり",受電,キャンセル / Cancellation,コールバック予定,09:42:00,2025-10-14T09:47:00+09:00
14-10-2025,FUJITA CC,33,４１１,75,９１,96,"urgent, QA to review, customer requested callback",Inbound,支払いエラー / Payment error,コールバック予定,12:13,2025/10/14 12:19
10/14/2025,Ishikawa Z,23,343,85,85,95,クレーム傾向あり,発信,請求 / Billing,Resolved,2025-10-14T15:37:00+09:00,15:53
2025/10/14,ハヤシ,15,191,95,78,96,"N/A, VIP customer",OUT-BOUND,その他 / Other,Partially Resolved,NULL,NULL
10/14/2025, Maria R ,38,416,86,85,,,受電,その他 / Other,コールバック予定,2025-10-14T10:50:00+09:00,2025-10-14T11:06:00+09:00
10/14/2025,Emily T,13,551,97,81,97,,受電,配送遅延 / Delivery delay,Unresolved,2025-10-14T12:50:00+09:00,2025/10/14 13:08
10/14/2025,kondo ff,26,349,67,87 %,97,customer requested callback,発信,その他 / Other,一次対応のみ,2025/10/14 11:47,11:54:00
2025-10-14T00:00:00+09:00,タナカ,,３３５,97,90,98,"QA to review, 新人対応",受電 ,その他 / Other,Unresolved,,
2025年10月14日, Saito T ,23,578,150,98,100,"manual check required
日本語メモあり",Inbound,配送遅延 / Delivery delay,Resolved,2025-10-14T13:35:00+09:00,2025-10-14T13:55:00+09:00
2025/10/14,Emily T,25,533,94,86,89,weird spike,発信 ,その他 / Other,エスカレーション,10:34,2025/10/14 10:38
10/14/2025,ITO F,NULL,NUL,78,78,95,"double break?
新人対応
日本語メモあり",受電,キャンセル / Cancellation,エスカレーション,19:11:00,19:24:00
2025-10-14T00:00:00+09:00, Yamaguchi N ,45,237,85,93,92 %,"manual check required, double break?",OUT-BOUND,返品 / Return,Resolved,2025/10/14 21:14,2025-10-14T21:23:00+09:00
2025年10月14日,WATANABE E,23,NUL,150,83,95,"weird spike, ※手動で確認",メール,配送遅延 / Delivery delay,Unresolved,13:21:00,2025/10/14 13:35
10/14/2025, Maria R ,10,389,82 %,84,88,"VIP customer, weird spike, double break?",発信,キャンセル / Cancellation,Resolved,2025/10/14 10:15,2025-10-14T10:23:00+09:00
14-10-2025,miyazaki jj,41,480,82,87,93,customer requested callback,Outbound,支払いエラー / Payment error,エスカレーション,12:20:00,2025-10-14T12:40:00+09:00
2025-10-15T00:00:00,ハヤシ,30,575,150,88,９７,,受電,アカウント / Account,コールバック予定,NULL,NULL
2025年10月15日,Hayashi R,,196,99,98 %,NUL,,受電 ,支払いエラー / Payment error,Unresolved,21:32,2025-10-15T21:37:00+09:00
15-10-2025,miyazaki jj,27,558,150,100,９４,日本語メモあり,受電,請求 / Billing,一次対応のみ,12:37,12:50:00
2025/10/15,kondo ff,19,NUL,,79,93,※手動で確認,メール,返品 / Return,Partially Resolved,2025/10/15 21:22,2025-10-15T21:25:00+09:00
2025-10-15T00:00:00,Kimura Q,23,384,72 %,96,89,"QA to review
weird spike",Inbound,配送遅延 / Delivery delay,エスカレーション,NULL,NULL
10/15/2025,Kimura Q,16,213,70,93 %,99,,Outbound,請求 / Billing,解決済み / Resolved,2025-10-15T11:33:00+09:00,2025-10-15T11:40:00+09:00
2025-10-15T00:00:00+09:00,Okada LL,28,260,74,83,88,"customer requested callback
N/A",inbound ,配送遅延 / Delivery delay,解決済み / Resolved,NULL,NULL
2025/10/15,Kimura Q,20,7200,70,NUL,95,customer requested callback,inbound ,キャンセル / Cancellation,エスカレーション,16:57:00,2025-10-15T17:08:00+09:00
10/15/2025, Mori V ,22,592,NUL,NULL,97,,メール,配送遅延 / Delivery delay,エスカレーション,19:37:00,19:56
10/15/2025,Goto NN,19,197,77,,100,,発信,その他 / Other,Transfer to L2,12:40:00,2025/10/15 12:55
15-10-2025,ITO F,42,275,100,NULL,100,"日本語メモあり
クレーム傾向あり
urgent",発信,支払いエラー / Payment error,Resolved,2025/10/15 17:45,2025/10/15 17:57
2025-10-15T00:00:00,Ishikawa Z,42,441,66,94,96 %,"weird spike
VIP customer
クレーム傾向あり",OUT-BOUND,支払いエラー / Payment error,Unresolved,19:40,2025/10/15 19:50
2025年10月15日,Yamazaki U,,385,95,87 %,96,"needs coaching
日本語メモあり
QA to review",発信,請求 / Billing,Partially Resolved,15:50,15:58
2025-10-15T00:00:00,Murakami EE,27,551,150,88 %,92,manual check required,Inbound,その他 / Other,Unresolved,2025-10-15T10:56:00+09:00,2025/10/15 11:09
2025-10-15T00:00:00,Kondo OO,37,534,98 %,97,98,manual check required,メール,キャンセル / Cancellation,一次対応のみ,19:32:00,2025-10-15T19:45:00+09:00
2025-10-15T00:00:00,ワタナベ,41,482,96,90,88,customer requested callback,Outbound,配送遅延 / Delivery delay,コールバック予定,2025/10/15 15:45,2025-10-15T15:49:00+09:00
15-10-2025,Sakamoto II,37,7200,66,87,92,※手動で確認,inbound ,配送遅延 / Delivery delay,エスカレーション,20:40:00,2025/10/15 20:51
2025年10月15日,SHIMIZU S,21,350,79,80,90,"N/A, double break?",チャット,請求 / Billing,Unresolved,14:01:00,14:07
2025/10/15,Sakamoto II,２２,519,99,90,100,,Outbound,その他 / Other,解決済み / Resolved,2025/10/15 12:35,12:42
2025-10-15T00:00:00+09:00,Sasaki M,24,254 sec,66,92,94,"QA to review, VIP customer, ※手動で確認",チャット,キャンセル / Cancellation,コールバック予定,14:23,14:33:00
2025-10-15T00:00:00+09:00,Sasaki M,１８,439,NULL,85,96,,inbound ,その他 / Other,エスカレーション,2025-10-15T16:37:00+09:00,2025/10/15 16:53
15-10-2025,Ishikawa Z,NULL,541,NUL,96,,"VIP customer, urgent",Outbound,その他 / Other,一次対応のみ,2025/10/15 17:44,17:56
2025/10/15,miyazaki jj,30,207,NULL,97 %,90,urgent,発信,支払いエラー / Payment error,Transfer to L2,2025/10/15 10:06,2025/10/15 10:21
15-10-2025,Kimura Q,31,270,76,89,100 %,,発信 ,技術サポート / Tech support,解決済み / Resolved,2025-10-15T19:23:00+09:00,2025-10-15T19:29:00+09:00
10/15/2025,Goto NN,33,276,87 %,82,99,"日本語メモあり
customer requested callback",受電 ,支払いエラー / Payment error,一次対応のみ,13:06,2025-10-15T13:20:00+09:00
2025-10-15T00:00:00+09:00, Abe W ,31,460,100 %,82,94 %,,発信,支払いエラー / Payment error,Resolved,2025/10/15 19:41,19:54
2025年10月15日,Yamamoto G,NUL,329,70,88,100,"日本語メモあり
weird spike
needs coaching",発信 ,請求 / Billing,Transfer to L2,,
10/15/2025, Kato J ,４４,402,150,84 %,91,,Outbound,技術サポート / Tech support,解決済み / Resolved,NULL,NULL
15-10-2025,ROMAN P,31,296,,85,98,manual check required,メール,アカウント / Account,解決済み / Resolved,15:52,2025/10/15 16:08
2025/10/15,Kondo OO,,201,79 %,83,93,"VIP customer, QA to review, ※手動で確認",メール,キャンセル / Cancellation,Resolved,2025-10-15T21:07:00+09:00,2025/10/15 21:22
2025-10-16T00:00:00+09:00,Yamazaki U,12,NULL,89,80,90,"double break?, weird spike, VIP customer",inbound ,技術サポート / Tech support,Unresolved,14:55,2025-10-16T15:06:00+09:00
10/16/2025,Sakamoto II,28,501,93 %,94,93 %,"クレーム傾向あり
double break?",OUT-BOUND,配送遅延 / Delivery delay,Transfer to L2,NULL,NULL
2025/10/16,ワタナベ,NULL,470,99 %,93,97,,発信,キャンセル / Cancellation,Transfer to L2,19:29:00,19:47
2025年10月16日,Miyazaki JJ,21,311,,82 %,96,,チャット,返品 / Return,コールバック予定,2025/10/16 15:56,2025/10/16 16:12
2025年10月16日,Noah W,35,305,150,97,100,,OUT-BOUND,その他 / Other,Resolved,2025/10/16 17:41,2025-10-16T17:58:00+09:00
2025-10-16T00:00:00+09:00,Yamazaki U,20,401,89,99,100,VIP customer,発信,配送遅延 / Delivery delay,解決済み / Resolved,NULL,NULL
2025年10月16日,Kobayashi I,30,560,88,92,89,QA to review,発信 ,アカウント / Account,Unresolved,17:35,2025-10-16T17:53:00+09:00
2025-10-16T00:00:00+09:00,HASEGAWA KK,16,NULL,89,96,97,,発信,配送遅延 / Delivery delay,Transfer to L2,10:56:00,2025/10/16 11:10
2025-10-16T00:00:00,Miyazaki JJ,22,544,96 %,91,96,"N/A
urgent",Outbound,キャンセル / Cancellation,一次対応のみ,,
16-10-2025,サトウ,15,7200,65,,９５,"QA to review, N/A, VIP customer",受電,アカウント / Account,Transfer to L2,11:22:00,2025-10-16T11:33:00+09:00
16-10-2025,Emily T,NULL,343,,81,NUL,double break?,Inbound,技術サポート / Tech support,解決済み / Resolved,20:51,2025/10/16 21:04
2025年10月16日,タナカ,16,5,NULL,80,NULL,"weird spike, double break?, 日本語メモあり",受電,配送遅延 / Delivery delay,Partially Resolved,16:52,2025/10/16 17:01
16-10-2025,Yamamoto G,13,220,NULL,84,NUL,,チャット,返品 / Return,Unresolved,15:40:00,15:52
2025年10月16日,nakamura h,25,529,NUL,NUL,99 %,"needs coaching, manual check required",発信,技術サポート / Tech support,Resolved,2025-10-16T14:37:00+09:00,14:51:00
2025年10月16日,Suzuki B,40,430,150,,95,"新人対応, double break?",OUT-BOUND,アカウント / Account,コールバック予定,09:55,2025/10/16 10:02
2025-10-16T00:00:00,Noah W,21,291 sec,74,93,96,"QA to review, double break?",OUT-BOUND,その他 / Other,解決済み / Resolved,14:06:00,14:11
2025/10/16,ROMAN P,23,7200,75,97,92,N/A,発信,支払いエラー / Payment error,解決済み / Resolved,16:23,16:39:00
10/16/2025,タナカ,45,537,79,85,,QA to review,発信 ,配送遅延 / Delivery delay,Resolved,17:31:00,2025-10-16T17:48:00+09:00
10/16/2025,Emily T,27,578 sec,65,93,95,"weird spike
customer requested callback
VIP customer",inbound ,返品 / Return,一次対応のみ,2025-10-16T12:50:00+09:00,13:05:00
2025-10-16T00:00:00+09:00,Kondo OO,NUL,7200,91 %,82,95,,メール,返品 / Return,エスカレーション,NULL,NULL
2025年10月16日,Kobayashi I,33,372,90,79,88,新人対応,Inbound,請求 / Billing,Unresolved,10:33:00,10:41:00
2025-10-16T00:00:00,john s,14,448,100,92,91,manual check required,Outbound,その他 / Other,解決済み / Resolved,09:14,09:24:00
10/16/2025,Goto NN,３５,432 sec,91,,91,customer requested callback,受電 ,請求 / Billing,コールバック予定,,
16-10-2025,タナカ,27,261,77,81,98,,Inbound,技術サポート / Tech support,コールバック予定,21:06:00,21:15
2025年10月16日,Sofia V,13,３０９,,88,93,"新人対応, クレーム傾向あり",Outbound,支払いエラー / Payment error,Resolved,09:54:00,2025-10-16T09:57:00+09:00
10/16/2025, Kato J ,２０,510,69,87,92,needs coaching,inbound ,その他 / Other,Unresolved,09:07:00,09:12:00
16-10-2025,INOUE P,14,NUL,NUL,78 %,95,manual check required,メール,キャンセル / Cancellation,エスカレーション,,
2025-10-16T00:00:00+09:00,TAKAHASHI C,38,202,96,79,95,"クレーム傾向あり
double break?
urgent",チャット,アカウント / Account,Unresolved,18:25:00,18:39
10/16/2025,WATANABE E,36,488,94,９９,98,"urgent, customer requested callback, double break?",Outbound,アカウント / Account,Resolved,2025-10-16T15:56:00+09:00,2025-10-16T16:02:00+09:00
2025/10/16,Kondo OO,20,583,88,99,94,,発信,請求 / Billing,Partially Resolved,2025-10-16T20:00:00+09:00,20:19:00
10/17/2025,ROMAN P,23,5,66 %,84,NUL,,Inbound,アカウント / Account,Transfer to L2,2025/10/17 19:25,19:28:00
2025年10月17日,FUJITA CC,40,５２７,66,90,97,"日本語メモあり
QA to review",発信,支払いエラー / Payment error,エスカレーション,2025-10-17T13:34:00+09:00,2025/10/17 13:39
17-10-2025,Kimura Q,４０,577,71 %,99,96,"manual check required
VIP customer
日本語メモあり",Inbound,その他 / Other,Unresolved,,
2025年10月17日,Okada LL,19,5,80 %,98,,,チャット,その他 / Other,Partially Resolved,2025-10-17T20:28:00+09:00,2025/10/17 20:34
2025年10月17日, Abe W ,３７,535,67,91 %,NULL,"N/A, 新人対応, QA to review",Outbound,請求 / Billing,Resolved,2025/10/17 09:10,09:15:00
2025年10月17日,Ishikawa Z,21,NULL,,87,,,inbound ,支払いエラー / Payment error,一次対応のみ,18:33:00,18:36
2025-10-17T00:00:00+09:00, Mori V ,40,268,69 %,94,89,"N/A, weird spike, ※手動で確認",受電,技術サポート / Tech support,Transfer to L2,21:25:00,2025/10/17 21:28
2025/10/17,Emily T,24,NULL,97,98,100 %,"needs coaching
クレーム傾向あり",OUT-BOUND,技術サポート / Tech support,Transfer to L2,13:25:00,13:36:00
2025/10/17, Yamaguchi N ,29,429,100,99,99,"needs coaching
※手動で確認
manual check required",メール,キャンセル / Cancellation,Partially Resolved,14:59:00,15:12:00
2025年10月17日,Yamazaki U,36,522,73,84,93,VIP customer,メール,返品 / Return,Partially Resolved,2025/10/17 18:50,19:03:00
10/17/2025,ROMAN P,27,354,89,78 %,92,"※手動で確認, クレーム傾向あり, customer requested callback",メール,技術サポート / Tech support,コールバック予定,2025-10-17T19:31:00+09:00,19:37
2025-10-17T00:00:00,スズキ,１３,5,NULL,82,91 %,日本語メモあり,発信 ,キャンセル / Cancellation,一次対応のみ,15:15:00,15:25:00
2025-10-17T00:00:00+09:00,ROMAN P,,570,78,,97,,発信,支払いエラー / Payment error,Resolved,12:54,13:10
2025年10月17日,NAKAJIMA AA,NUL,337,93,NULL,NULL,"urgent, VIP customer",発信 ,アカウント / Account,解決済み / Resolved,2025/10/17 17:48,17:59:00
2025-10-17T00:00:00,Goto NN,34,３７０,89,84,92,manual check required,Outbound,支払いエラー / Payment error,エスカレーション,2025/10/17 20:51,2025-10-17T20:54:00+09:00
10/17/2025, Abe W ,３７,297,75,98,88,VIP customer,Inbound,技術サポート / Tech support,一次対応のみ,2025/10/17 10:33,10:44:00
2025-10-17T00:00:00+09:00,スズキ,20,227,76,91,91,"double break?, urgent",発信,配送遅延 / Delivery delay,Unresolved,NULL,NULL
2025年10月17日,Maeda BB,11,３８１,150 %,89,90,,発信 ,技術サポート / Tech support,Resolved,2025/10/17 15:08,2025/10/17 15:11
2025/10/17,Ishikawa Z,43,446,90,91,88,"needs coaching, customer requested callback",受電,アカウント / Account,一次対応のみ,14:01,2025/10/17 14:14
17-10-2025,miyazaki jj,38,563,74 %,92,93,weird spike,Inbound,キャンセル / Cancellation,Transfer to L2,2025/10/17 09:22,2025-10-17T09:39:00+09:00
2025年10月17日,Okada LL,42,7200,95 %,87,90,,受電 ,返品 / Return,Transfer to L2,09:28:00,09:43:00
2025年10月17日,Yamamoto G,NULL,243,97 %,96,94,"※手動で確認, urgent, VIP customer",Outbound,支払いエラー / Payment error,コールバック予定,,
2025-10-17T00:00:00, Kato J ,22,NUL,74,84 %,NUL,"VIP customer, 新人対応",Outbound,その他 / Other,Unresolved,19:31:00,19:37:00
2025年10月17日, Mori V ,45,349,150,94,９１,"クレーム傾向あり, ※手動で確認",受電,技術サポート / Tech support,一次対応のみ,21:55,22:06
10/17/2025,ROMAN P,16,391,70,99 %,88,,発信,技術サポート / Tech support,Transfer to L2,2025/10/17 14:07,2025/10/17 14:19
2025-10-17T00:00:00+09:00,Sofia V,25,264,70 %,NULL,90,,OUT-BOUND,技術サポート / Tech support,解決済み / Resolved,16:11:00,16:15:00
2025/10/17,HASEGAWA KK,NULL,NUL,71 %,79,90,"customer requested callback, ※手動で確認",受電 ,支払いエラー / Payment error,一次対応のみ,2025-10-17T11:04:00+09:00,2025/10/17 11:21
2025-10-17T00:00:00+09:00,Okada LL,12,263,97,90,92,"urgent
日本語メモあり
needs coaching",Inbound,請求 / Billing,Resolved,16:08:00,16:15:00
2025-10-17T00:00:00+09:00,Sofia V,37,522,78,89,NUL,,メール,アカウント / Account,Unresolved,2025/10/17 16:29,16:44
17-10-2025,Goto NN,37,564,,86,90 %,,受電 ,その他 / Other,一次対応のみ,12:46:00,12:54:00
2025年10月18日,Fujii MM,16,436,97,94,94,,発信 ,キャンセル / Cancellation,エスカレーション,,
18-10-2025,Sofia V,14,417,85,86,,,発信 ,キャンセル / Cancellation,コールバック予定,2025/10/18 13:00,13:19
2025-10-18T00:00:00,Sakamoto II,14,596,,98,95,"double break?, needs coaching",受電,配送遅延 / Delivery delay,Unresolved,,
2025-10-18T00:00:00,nakamura h,25,7200,NULL,86,90,,Inbound,キャンセル / Cancellation,一次対応のみ,NULL,NULL
2025-10-18T00:00:00,Miyazaki JJ,10,5,82,92,96,"double break?
needs coaching",Inbound,配送遅延 / Delivery delay,Unresolved,2025-10-18T15:51:00+09:00,2025-10-18T16:00:00+09:00
2025-10-18T00:00:00+09:00, Saito T ,NUL,NUL,99,98,100,"weird spike
urgent",発信,支払いエラー / Payment error,Partially Resolved,19:59:00,20:17:00
2025-10-18T00:00:00,Yamazaki U,,NUL,66,98,,"needs coaching, urgent",発信 ,支払いエラー / Payment error,Unresolved,16:31:00,2025-10-18T16:51:00+09:00
2025-10-18T00:00:00,Fujii MM,30,397,NUL,82,92,,受電 ,配送遅延 / Delivery delay,Resolved,NULL,NULL
2025年10月18日,Yamamoto G,15,488,NULL,88,97,,受電 ,支払いエラー / Payment error,一次対応のみ,2025-10-18T17:42:00+09:00,17:54:00
2025-10-18T00:00:00,Aoki HH,27,NULL,NUL,78,93,,受電 ,返品 / Return,Resolved,2025-10-18T14:10:00+09:00,2025-10-18T14:18:00+09:00
2025-10-18T00:00:00+09:00, Mori V ,18,529,,86,95,,受電,返品 / Return,一次対応のみ,14:08:00,14:23:00
2025/10/18,ROMAN P,17,489,77,96,98,,Outbound,技術サポート / Tech support,Resolved,2025-10-18T19:25:00+09:00,2025-10-18T19:32:00+09:00
2025-10-18T00:00:00+09:00,Ikeda X,10,408,88,99,98,,Outbound,その他 / Other,エスカレーション,13:27,2025-10-18T13:31:00+09:00
18-10-2025,Kobayashi I,28,NULL,83,78,NUL,"manual check required, weird spike",メール,その他 / Other,コールバック予定,2025-10-18T13:10:00+09:00,13:28
10/18/2025,Ikeda X,45,236,71,８７,89,"クレーム傾向あり, customer requested callback, VIP customer",受電 ,請求 / Billing,エスカレーション,2025/10/18 17:00,17:07:00
10/18/2025,ワタナベ,16,397,90,96,91,"新人対応, weird spike",発信,返品 / Return,コールバック予定,17:01,2025/10/18 17:06
2025-10-18T00:00:00+09:00,ヤマダ,44,5,100,84,97,"weird spike
needs coaching",Outbound,支払いエラー / Payment error,Resolved,21:16,2025-10-18T21:36:00+09:00
18-10-2025, Mori V ,20,183,91,NULL,91,"N/A, 新人対応",OUT-BOUND,技術サポート / Tech support,Resolved,19:36,19:39
2025-10-18T00:00:00,サトウ,22,NUL,68,82 %,99,"manual check required
QA to review",Inbound,請求 / Billing,エスカレーション,2025/10/18 15:00,2025-10-18T15:08:00+09:00
2025-10-18T00:00:00+09:00,Alex Q,19,538,100,96,95,"weird spike
新人対応
QA to review",発信,キャンセル / Cancellation,Transfer to L2,2025-10-18T13:38:00+09:00,13:47
2025年10月18日,Sakamoto II,44,5,73,100,94,日本語メモあり,受電 ,返品 / Return,Unresolved,2025-10-18T12:58:00+09:00,13:02
2025/10/18, Yamaguchi N ,NULL,227,NULL,91,100,"新人対応, needs coaching, QA to review",受電 ,支払いエラー / Payment error,Transfer to L2,2025-10-18T16:10:00+09:00,2025-10-18T16:21:00+09:00
2025-10-18T00:00:00,miyazaki jj,11,222,70 %,81,88,"urgent
N/A
VIP customer",Inbound,キャンセル / Cancellation,一次対応のみ,2025/10/18 13:10,13:15:00
2025/10/18, Abe W ,14,327,95 %,78 %,,QA to review,チャット,支払いエラー / Payment error,Transfer to L2,2025-10-18T20:33:00+09:00,20:44
2025-10-18T00:00:00+09:00,Aoki HH,42,518 sec,75,７９,94,"新人対応, customer requested callback, N/A",inbound ,請求 / Billing,Unresolved,2025/10/18 10:03,10:14:00
2025-10-18T00:00:00,Endo GG,43,555,150,85,96,,Inbound,請求 / Billing,コールバック予定,18:43:00,2025/10/18 18:55
2025-10-18T00:00:00+09:00, Kato J ,,567,98,NULL,92 %,"※手動で確認
manual check required",チャット,配送遅延 / Delivery delay,一次対応のみ,09:11:00,09:26:00
18-10-2025, Yamaguchi N ,22,191,82,94,99,"urgent, ※手動で確認, N/A",OUT-BOUND,その他 / Other,解決済み / Resolved,,
18-10-2025,WATANABE E,NULL,302,87,96,91,,発信 ,その他 / Other,エスカレーション,20:56,21:02
2025-10-18T00:00:00,Sofia V,22,NULL,79 %,79,97,"needs coaching, 新人対応",受電,技術サポート / Tech support,解決済み / Resolved,NULL,NULL
2025年10月19日,Ogawa DD,17,448,95,87,94,"N/A, customer requested callback",OUT-BOUND,技術サポート / Tech support,Resolved,13:38:00,2025-10-19T13:43:00+09:00
2025年10月19日, Yamaguchi N ,35,193,75,84,NUL,"N/A
QA to review",メール,技術サポート / Tech support,一次対応のみ,11:33:00,2025-10-19T11:53:00+09:00
2025年10月19日,miyazaki jj,35,560 sec,72,78,88,"needs coaching
日本語メモあり
QA to review",発信,支払いエラー / Payment error,Transfer to L2,20:13:00,20:19:00
2025-10-19T00:00:00,Murakami EE,42,235,100,84,88,"新人対応
weird spike
N/A",発信,請求 / Billing,コールバック予定,2025-10-19T09:13:00+09:00,2025-10-19T09:23:00+09:00
19-10-2025,Ogawa DD,11,7200,69,83,92,"customer requested callback, double break?, manual check required",発信 ,アカウント / Account,一次対応のみ,17:41,17:58:00
10/19/2025,Sofia V,25,330 sec,84,84,NULL,※手動で確認,受電,アカウント / Account,解決済み / Resolved,2025/10/19 15:39,2025-10-19T15:42:00+09:00
10/19/2025,Matsumoto O,11,NUL,100,94,93,"クレーム傾向あり, 日本語メモあり, ※手動で確認",チャット,アカウント / Account,Resolved,11:57,2025/10/19 12:13
2025年10月19日,Sofia V,19,581,69,95,98,"customer requested callback, N/A",Inbound,キャンセル / Cancellation,Partially Resolved,21:17:00,21:32:00
2025-10-19T00:00:00,タナカ,20,183,89 %,NUL,100,,Outbound,配送遅延 / Delivery delay,解決済み / Resolved,09:04:00,2025-10-19T09:19:00+09:00
19-10-2025,Yamamoto G,３０,270,93,79,88,"urgent, 日本語メモあり",発信,請求 / Billing,コールバック予定,21:55:00,2025-10-19T22:11:00+09:00
2025-10-19T00:00:00,Ishikawa Z,41,376,69,90,91,,OUT-BOUND,配送遅延 / Delivery delay,Transfer to L2,2025/10/19 20:59,2025-10-19T21:07:00+09:00
2025/10/19,Matsumoto O,３９,２６４,150,91,90,"needs coaching
weird spike",Inbound,キャンセル / Cancellation,一次対応のみ,13:37:00,2025-10-19T13:41:00+09:00
10/19/2025,Miyazaki JJ,12,5,68,86,90,"urgent
double break?
needs coaching",OUT-BOUND,支払いエラー / Payment error,エスカレーション,2025/10/19 18:34,18:42
2025/10/19, Maria R ,41,404,99,94,88,"日本語メモあり, 新人対応, customer requested callback",受電,アカウント / Account,Resolved,16:30,2025/10/19 16:34
2025-10-19T00:00:00+09:00,Endo GG,10,7200,70,85,94,,チャット,その他 / Other,Resolved,19:16,2025-10-19T19:31:00+09:00
2025-10-19T00:00:00+09:00, Maria R ,35,200,80,87,９０,customer requested callback,Outbound,アカウント / Account,一次対応のみ,2025-10-19T17:18:00+09:00,2025-10-19T17:25:00+09:00
2025年10月19日,Yamamoto G,44,564,87,95,100,"※手動で確認, QA to review",発信 ,支払いエラー / Payment error,エスカレーション,2025/10/19 16:39,2025/10/19 16:59
2025-10-19T00:00:00+09:00,kondo ff,18,４３２,85,,98,,メール,技術サポート / Tech support,Transfer to L2,2025/10/19 21:24,2025-10-19T21:39:00+09:00
19-10-2025,INOUE P,NUL,457,82,90,97,manual check required,発信 ,キャンセル / Cancellation,コールバック予定,2025-10-19T12:55:00+09:00,13:04:00
2025-10-19T00:00:00+09:00,Sakamoto II,30,549,86,83,91,weird spike,受電 ,支払いエラー / Payment error,コールバック予定,14:23:00,2025/10/19 14:26
2025年10月19日,Ishikawa Z,,429,65,81,89,"urgent
日本語メモあり",チャット,返品 / Return,一次対応のみ,21:02:00,2025-10-19T21:07:00+09:00
2025年10月19日,Goto NN,30,290,91,94 %,９５,"urgent, VIP customer",Inbound,キャンセル / Cancellation,Resolved,2025-10-19T09:49:00+09:00,2025/10/19 10:03
2025-10-19T00:00:00,Ishikawa Z,18,7200,80,89,96,N/A,発信 ,アカウント / Account,エスカレーション,2025/10/19 17:28,17:39:00
2025年10月19日,Hayashi R,27,481,83,97,９４,日本語メモあり,メール,配送遅延 / Delivery delay,Partially Resolved,2025-10-19T18:41:00+09:00,18:51:00
2025-10-19T00:00:00,Goto NN,30,7200,92,81,97,"urgent, 新人対応",Outbound,アカウント / Account,エスカレーション,2025/10/19 19:50,20:07
2025-10-19T00:00:00,サトウ,NUL,558,69,83,NULL,,Inbound,請求 / Billing,Partially Resolved,2025-10-19T18:09:00+09:00,2025/10/19 18:12
2025-10-19T00:00:00,サトウ,43,261,99,94,90,"N/A
クレーム傾向あり
manual check required",OUT-BOUND,アカウント / Account,Unresolved,2025/10/19 18:02,2025/10/19 18:15
2025/10/19,HASEGAWA KK,16,273,76 %,84,97,N/A,OUT-BOUND,返品 / Return,コールバック予定,2025-10-19T11:06:00+09:00,11:22:00
2025/10/19,ROMAN P,25,366,99,87,95,,受電,キャンセル / Cancellation,Partially Resolved,2025/10/19 09:36,2025-10-19T09:49:00+09:00
10/19/2025,スズキ,３８,405 sec,NUL,97,89,customer requested callback,受電 ,返品 / Return,Unresolved,2025-10-19T11:01:00+09:00,11:07
2025-10-20T00:00:00,スズキ,26,595,97,99,93,,受電 ,アカウント / Account,解決済み / Resolved,21:53:00,21:57
20-10-2025,Kimura Q,NULL,586,NUL,83,89 %,,発信 ,請求 / Billing,Transfer to L2,19:01,2025-10-20T19:06:00+09:00
2025-10-20T00:00:00+09:00,Fujii MM,36,5,96 %,82,89,"新人対応, QA to review, double break?",OUT-BOUND,技術サポート / Tech support,Resolved,2025-10-20T18:49:00+09:00,18:54
2025-10-20T00:00:00,スズキ,NUL,408,98,84,92,"日本語メモあり, manual check required, urgent",メール,支払いエラー / Payment error,Unresolved,2025-10-20T21:50:00+09:00,2025/10/20 22:02
2025/10/20,タナカ,NUL,184,NULL,90,99,"double break?, needs coaching",inbound ,返品 / Return,Transfer to L2,11:49,2025/10/20 12:07
2025-10-20T00:00:00+09:00,ITO F,37,456,78,80,,QA to review,発信 ,請求 / Billing,エスカレーション,2025-10-20T12:35:00+09:00,2025/10/20 12:53
20-10-2025,Suzuki B,37,391,71,83,91,,inbound ,支払いエラー / Payment error,解決済み / Resolved,2025/10/20 18:23,18:38:00
2025年10月20日,nakamura h,33,358,150,81,88,"needs coaching
日本語メモあり
weird spike",受電,返品 / Return,Resolved,16:25,2025/10/20 16:36
2025-10-20T00:00:00,Endo GG,４３,367,,88,88,,Outbound,配送遅延 / Delivery delay,Resolved,09:52:00,2025/10/20 10:04
2025-10-20T00:00:00+09:00, Kato J ,21,NUL,,89,94,needs coaching,チャット,返品 / Return,Partially Resolved,2025/10/20 18:25,18:33:00
10/20/2025,nakamura h,１９,448,66 %,90,98,新人対応,発信,支払いエラー / Payment error,一次対応のみ,2025-10-20T09:01:00+09:00,09:12:00
2025-10-20T00:00:00, Maria R ,14,NUL,97 %,98,94,manual check required,発信,その他 / Other,Resolved,2025/10/20 15:24,2025-10-20T15:44:00+09:00
2025-10-20T00:00:00+09:00,Miyazaki JJ,13,307,76,94,89,,メール,請求 / Billing,コールバック予定,NULL,NULL
2025/10/20,Matsumoto O,１６,5,150,,98,"double break?
needs coaching
weird spike",発信 ,その他 / Other,Unresolved,10:05:00,2025-10-20T10:22:00+09:00
2025/10/20, Saito T ,26,NULL,93,94,95,"urgent
日本語メモあり
VIP customer",inbound ,アカウント / Account,エスカレーション,14:30,2025/10/20 14:35
2025-10-20T00:00:00, Maria R ,３５,223,82,91,100,"manual check required
double break?",inbound ,配送遅延 / Delivery delay,Partially Resolved,2025/10/20 20:07,2025-10-20T20:18:00+09:00
10/20/2025,Murakami EE,,508,100,90,100,※手動で確認,発信 ,アカウント / Account,一次対応のみ,2025/10/20 18:24,2025-10-20T18:39:00+09:00
10/20/2025,TAKAHASHI C,１９,7200,71,89,92,"double break?, weird spike, ※手動で確認",受電 ,返品 / Return,解決済み / Resolved,2025/10/20 15:08,2025-10-20T15:19:00+09:00
2025-10-20T00:00:00,nakamura h,１４,5,72,85,90,weird spike,受電,技術サポート / Tech support,Transfer to L2,2025-10-20T11:15:00+09:00,2025/10/20 11:19
20-10-2025,john s,,NUL,82,86,88,,発信 ,アカウント / Account,コールバック予定,2025-10-20T10:30:00+09:00,10:48
2025年10月20日,Sasaki M,44,553 sec,100 %,92,100,,受電,アカウント / Account,一次対応のみ,2025/10/20 17:27,2025/10/20 17:47
2025/10/20, Kato J ,29,347,68 %,97,95,"日本語メモあり
N/A
needs coaching",Inbound,アカウント / Account,解決済み / Resolved,2025/10/20 12:53,13:13
2025年10月20日,Aoki HH,18,３４７,68 %,96,９７,"manual check required, ※手動で確認",受電 ,アカウント / Account,コールバック予定,16:26,2025-10-20T16:30:00+09:00
2025年10月20日, Kato J ,33,455,84,84,,,チャット,キャンセル / Cancellation,コールバック予定,2025/10/20 15:50,15:57:00
2025年10月20日,Sasaki M,NULL,351,65,83,90,"VIP customer, manual check required",受電,請求 / Billing,Transfer to L2,,
2025-10-20T00:00:00+09:00,Alex Q,１６,437,89,,96 %,"QA to review, 新人対応, VIP customer",OUT-BOUND,返品 / Return,Resolved,2025-10-20T11:36:00+09:00,11:50:00
2025-10-20T00:00:00+09:00,Emily T,36,５０６,75 %,85,94,"日本語メモあり
新人対応
クレーム傾向あり",OUT-BOUND,配送遅延 / Delivery delay,一次対応のみ,17:11,17:23:00
2025年10月20日,Kondo OO,２７,399,94,84,91,"customer requested callback, VIP customer, 新人対応",発信 ,支払いエラー / Payment error,エスカレーション,16:57:00,17:12
2025-10-20T00:00:00+09:00, Abe W ,,464,95,,100,日本語メモあり,Outbound,技術サポート / Tech support,コールバック予定,18:50,19:00:00
2025-10-20T00:00:00+09:00,Fujii MM,24,7200,71,90,89,,メール,キャンセル / Cancellation,Transfer to L2,13:16:00,2025-10-20T13:32:00+09:00
2025/10/21, Mori V ,38,187,85,82,92,"customer requested callback, QA to review, double break?",OUT-BOUND,技術サポート / Tech support,一次対応のみ,2025/10/21 14:30,14:37
10/21/2025,Kondo OO,15,456,82 %,95,91,,Inbound,その他 / Other,解決済み / Resolved,15:58,2025-10-21T16:06:00+09:00
2025/10/21,kondo ff,23,NULL,65,78 %,94,,inbound ,その他 / Other,コールバック予定,10:00:00,2025/10/21 10:20
2025年10月21日,Alex Q,NULL,463,70,93,96,"N/A
manual check required
needs coaching",Outbound,技術サポート / Tech support,エスカレーション,,
2025年10月21日,TAKAHASHI C,34,5,,91,92 %,,受電,配送遅延 / Delivery delay,一次対応のみ,10:45,10:50:00
10/21/2025,ワタナベ,16,482,,89,96,"customer requested callback, double break?, VIP customer",受電,その他 / Other,解決済み / Resolved,2025-10-21T17:14:00+09:00,2025/10/21 17:34
21-10-2025,Endo GG,41,5,,91,NUL,"日本語メモあり, VIP customer",OUT-BOUND,技術サポート / Tech support,Resolved,11:27,2025/10/21 11:41
2025年10月21日,ワタナベ,45,472,NUL,88,95,新人対応,発信 ,請求 / Billing,Resolved,2025/10/21 10:34,10:54
2025年10月21日,nakamura h,19,442,81,82,93,"urgent
日本語メモあり
customer requested callback",チャット,その他 / Other,解決済み / Resolved,NULL,NULL
10/21/2025,タナカ,31,415,95,95,92 %,,受電 ,請求 / Billing,Unresolved,2025/10/21 20:16,2025-10-21T20:33:00+09:00
2025/10/21,Kimura Q,３３,5,100,79 %,88,manual check required,OUT-BOUND,アカウント / Account,Resolved,2025/10/21 20:56,2025-10-21T21:00:00+09:00
2025-10-21T00:00:00+09:00, Maria R ,12,４８３,81,98 %,100,double break?,発信 ,その他 / Other,コールバック予定,18:35,18:44:00
10/21/2025,TAKAHASHI C,36,5,97,84,NULL,"double break?
needs coaching
日本語メモあり",inbound ,請求 / Billing,Transfer to L2,2025/10/21 21:35,21:50:00
21-10-2025,FUJITA CC,26,303,68,95,97,"クレーム傾向あり
double break?",メール,請求 / Billing,Transfer to L2,21:14:00,2025/10/21 21:29
2025/10/21,ハヤシ,,408,90,89 %,90,"日本語メモあり, クレーム傾向あり, N/A",チャット,支払いエラー / Payment error,解決済み / Resolved,2025-10-21T16:40:00+09:00,16:52
2025-10-21T00:00:00,Ogawa DD,39,228,NULL,100,NUL,manual check required,発信 ,配送遅延 / Delivery delay,Partially Resolved,14:52,2025-10-21T15:03:00+09:00
21-10-2025,Alex Q,NUL,340,68 %,100,91,"double break?, manual check required",発信 ,キャンセル / Cancellation,エスカレーション,,
2025-10-21T00:00:00,Yamamoto G,４１,277,87,89,89 %,"manual check required
customer requested callback",メール,技術サポート / Tech support,Partially Resolved,,
2025-10-21T00:00:00+09:00,Murakami EE,23,537,NUL,97,93,,受電 ,配送遅延 / Delivery delay,Transfer to L2,21:48:00,21:58
2025年10月21日,ヤマダ,１２,４７１,,95 %,99,新人対応,OUT-BOUND,返品 / Return,Partially Resolved,18:54:00,19:06
2025-10-21T00:00:00,INOUE P,39,２６０,150,,94,"needs coaching, 新人対応",OUT-BOUND,技術サポート / Tech support,Unresolved,19:36:00,2025-10-21T19:43:00+09:00
2025-10-21T00:00:00, Saito T ,12,３９５,99,86,89,"日本語メモあり
※手動で確認
manual check required",発信,配送遅延 / Delivery delay,エスカレーション,2025/10/21 14:54,15:02:00
10/21/2025,Maeda BB,,303,150 %,92,NUL,"日本語メモあり, VIP customer",inbound ,その他 / Other,Resolved,2025-10-21T10:51:00+09:00,11:05
10/21/2025,Yamazaki U,２０,５５１,98,93,94,"N/A, double break?, クレーム傾向あり",発信 ,配送遅延 / Delivery delay,エスカレーション,2025-10-21T20:30:00+09:00,2025-10-21T20:38:00+09:00
2025年10月21日,SHIMIZU S,40,４８９,74,83,92,urgent,発信,請求 / Billing,解決済み / Resolved,09:11,09:31
21-10-2025,ハヤシ,13,429,98,NUL,93,"urgent, VIP customer, manual check required",OUT-BOUND,技術サポート / Tech support,Partially Resolved,2025/10/21 09:17,2025/10/21 09:24
2025-10-21T00:00:00+09:00,Murakami EE,16,201,91,,91 %,N/A,発信 ,返品 / Return,エスカレーション,16:29,16:43
2025-10-21T00:00:00,miyazaki jj,20,5,69,97 %,97,,inbound ,キャンセル / Cancellation,Partially Resolved,20:34,20:45
2025-10-21T00:00:00, Maria R ,22,187,88,90,94,,発信 ,アカウント / Account,Transfer to L2,14:03:00,14:15:00
2025-10-21T00:00:00,Ikeda X,37,NUL,77,89 %,94,"urgent, QA to review",Inbound,支払いエラー / Payment error,一次対応のみ,11:16:00,11:25:00
22-10-2025,TAKAHASHI C,42,200,71,82,99 %,"QA to review
※手動で確認
weird spike",チャット,返品 / Return,Unresolved,20:18:00,2025-10-22T20:35:00+09:00
2025/10/22,Noah W,25,597 sec,69 %,99,99,"VIP customer, customer requested callback",発信,配送遅延 / Delivery delay,エスカレーション,15:37:00,15:48
2025-10-22T00:00:00+09:00,Noah W,40,377,69,82 %,93 %,customer requested callback,発信 ,キャンセル / Cancellation,Resolved,14:11:00,2025/10/22 14:26
2025年10月22日,Sakamoto II,21,186,NULL,100,89,"manual check required, クレーム傾向あり",Outbound,請求 / Billing,コールバック予定,2025-10-22T10:19:00+09:00,2025/10/22 10:32
10/22/2025, Maria R ,39,５２８,72,89,93,"※手動で確認
N/A
urgent",メール,請求 / Billing,コールバック予定,2025/10/22 17:51,2025-10-22T18:08:00+09:00
10/22/2025,ITO F,20,526 sec,86,85,94,,発信,技術サポート / Tech support,Resolved,NULL,NULL
22-10-2025,SHIMIZU S,19,212 sec,85,79 %,95,,メール,請求 / Billing,Transfer to L2,NULL,NULL
2025-10-22T00:00:00+09:00, Kato J ,17,383,NUL,79,93,"日本語メモあり
customer requested callback
manual check required",発信,返品 / Return,Transfer to L2,11:46,12:00
2025-10-22T00:00:00+09:00,Miyazaki JJ,38,447,95,85,94 %,新人対応,inbound ,その他 / Other,解決済み / Resolved,2025-10-22T17:11:00+09:00,17:26
10/22/2025,Yamazaki U,,7200,NULL,89,91,VIP customer,発信,アカウント / Account,一次対応のみ,17:55:00,2025/10/22 18:06
2025年10月22日,SHIMIZU S,NUL,290,NULL,100,92,"VIP customer, customer requested callback, urgent",OUT-BOUND,請求 / Billing,Transfer to L2,15:03:00,15:18
22-10-2025,Noah W,,505,69,79,８９,クレーム傾向あり,Inbound,配送遅延 / Delivery delay,Unresolved,2025/10/22 09:56,2025-10-22T10:01:00+09:00
2025年10月22日,Hayashi R,24,５１６,95 %,96 %,98,"※手動で確認, needs coaching, VIP customer",チャット,配送遅延 / Delivery delay,コールバック予定,13:01,13:06:00
2025/10/22,Emily T,２１,595,75,NUL,95 %,urgent,Outbound,返品 / Return,コールバック予定,2025/10/22 18:25,2025-10-22T18:42:00+09:00
2025/10/22, Maria R ,14,427,76 %,99,97,"QA to review, N/A, weird spike",Outbound,キャンセル / Cancellation,Partially Resolved,10:38:00,10:43
2025/10/22,INOUE P,31,NULL,,８０,100,"double break?, ※手動で確認",inbound ,技術サポート / Tech support,Unresolved,2025/10/22 15:35,2025/10/22 15:52
2025年10月22日,Sakamoto II,38,225,92,,88 %,,チャット,返品 / Return,エスカレーション,12:02,2025/10/22 12:17
2025-10-22T00:00:00,Emily T,NUL,512,85,９６,89,QA to review,Inbound,配送遅延 / Delivery delay,一次対応のみ,2025/10/22 17:39,17:59:00
10/22/2025,Yamamoto G,25,314,79,80,97,VIP customer,メール,キャンセル / Cancellation,エスカレーション,13:14,13:25
2025-10-22T00:00:00,NAKAJIMA AA,42,424,99,96,89,"urgent, 日本語メモあり",Inbound,その他 / Other,解決済み / Resolved,16:20,16:32:00
22-10-2025,タナカ,33,247,67,87,91,,チャット,支払いエラー / Payment error,Unresolved,2025/10/22 21:07,21:16:00
22-10-2025,Endo GG,22,526,92,NUL,91,"weird spike, ※手動で確認",受電,アカウント / Account,Partially Resolved,2025-10-22T10:04:00+09:00,10:14
2025-10-22T00:00:00+09:00,Yamamoto G,36,249 sec,84,91,98,"manual check required, double break?, QA to review",受電 ,技術サポート / Tech support,解決済み / Resolved,17:50:00,2025/10/22 18:03
2025/10/22,SHIMIZU S,19,511,69,79,NUL,,チャット,技術サポート / Tech support,Unresolved,2025/10/22 11:52,12:12:00
10/22/2025,スズキ,20,NULL,79 %,,97,日本語メモあり,メール,アカウント / Account,エスカレーション,2025/10/22 16:04,16:10:00
10/22/2025,ワタナベ,19,357,68,84 %,90,"新人対応
urgent",Outbound,キャンセル / Cancellation,Unresolved,NULL,NULL
22-10-2025,Sofia V,１１,263,NUL,92,92,新人対応,発信,配送遅延 / Delivery delay,一次対応のみ,NULL,NULL
22-10-2025,Noah W,44,583,69,79,94,"VIP customer, double break?, urgent",発信,返品 / Return,Partially Resolved,2025-10-22T16:36:00+09:00,2025-10-22T16:41:00+09:00
2025-10-22T00:00:00,Kobayashi I,４２,532,68,８０,92,"urgent, N/A, needs coaching",発信 ,キャンセル / Cancellation,Transfer to L2,2025-10-22T11:38:00+09:00,2025/10/22 11:51
2025-10-22T00:00:00+09:00,Ogawa DD,41,307,150,82,98,weird spike,inbound ,返品 / Return,Partially Resolved,2025-10-22T13:18:00+09:00,13:30:00
2025/10/23,Hayashi R,３１,591,89,80,98,QA to review,Outbound,請求 / Billing,Transfer to L2,2025/10/23 15:14,15:25:00
2025-10-23T00:00:00+09:00,Maeda BB,１９,5,99 %,82 %,99,,Inbound,配送遅延 / Delivery delay,コールバック予定,2025/10/23 12:02,12:09
2025-10-23T00:00:00+09:00,nakamura h,19,NUL,83,79,97,weird spike,Inbound,返品 / Return,解決済み / Resolved,09:17,2025-10-23T09:37:00+09:00
2025-10-23T00:00:00,Ikeda X,１９,580 sec,97,100,94,,inbound ,支払いエラー / Payment error,Resolved,NULL,NULL
2025年10月23日, Kato J ,１０,471,98,94,94,"needs coaching, customer requested callback, QA to review",Outbound,キャンセル / Cancellation,Unresolved,10:39,10:46
2025-10-23T00:00:00+09:00, Saito T ,29,7200,150,81,97,,発信,その他 / Other,Unresolved,21:26,21:37
23-10-2025,ITO F,13,389 sec,75,NUL,91,,受電,返品 / Return,Resolved,09:20,09:24
23-10-2025,Ishikawa Z,,532,75,97 %,96,"weird spike
double break?",受電 ,返品 / Return,コールバック予定,2025-10-23T19:50:00+09:00,19:59:00
2025-10-23T00:00:00,タナカ,44,573,NULL,87,91,,Outbound,請求 / Billing,Resolved,19:34,2025/10/23 19:53
2025/10/23,サトウ,14,571,95,NULL,,"N/A
customer requested callback
urgent",受電 ,支払いエラー / Payment error,一次対応のみ,2025/10/23 12:49,2025/10/23 12:54
10/23/2025,ITO F,17,476,84,99 %,99,"クレーム傾向あり, QA to review",発信 ,配送遅延 / Delivery delay,Resolved,11:20,11:37:00
2025-10-23T00:00:00+09:00,Goto NN,37,7200,84,97 %,95,"needs coaching, 新人対応",受電,その他 / Other,解決済み / Resolved,2025/10/23 17:00,17:20:00
2025年10月23日,Ishikawa Z,28,5,97,92,98,"needs coaching, QA to review, ※手動で確認",受電 ,技術サポート / Tech support,一次対応のみ,2025/10/23 13:20,2025-10-23T13:23:00+09:00
2025-10-23T00:00:00+09:00,Goto NN,NUL,196,90,79 %,92,日本語メモあり,受電 ,返品 / Return,解決済み / Resolved,14:30,2025/10/23 14:42
23-10-2025,Kondo OO,45,301 sec,93,79 %,,"double break?, manual check required",発信 ,配送遅延 / Delivery delay,Partially Resolved,09:58:00,10:12
2025/10/23,Emily T,28,437,72,９８,91,,Outbound,キャンセル / Cancellation,一次対応のみ,2025/10/23 13:16,2025/10/23 13:23
23-10-2025,TAKAHASHI C,37,599,89 %,81,95,urgent,inbound ,配送遅延 / Delivery delay,Partially Resolved,NULL,NULL
2025年10月23日, Abe W ,34,582,85,85,89,needs coaching,発信 ,技術サポート / Tech support,解決済み / Resolved,2025-10-23T20:15:00+09:00,2025-10-23T20:30:00+09:00
10/23/2025,kondo ff,19,260,80,100,97,VIP customer,Inbound,アカウント / Account,Resolved,2025-10-23T17:20:00+09:00,2025-10-23T17:38:00+09:00
2025-10-23T00:00:00,john s,13,312,88,82,99,N/A,発信 ,その他 / Other,Partially Resolved,,
10/23/2025,NAKAJIMA AA,11,NULL,70,NUL,98,,inbound ,その他 / Other,Unresolved,2025/10/23 21:58,2025/10/23 22:18
2025-10-23T00:00:00,Yamazaki U,45,212,91,88,96 %,N/A,発信,返品 / Return,一次対応のみ,2025/10/23 13:55,2025/10/23 14:10
2025/10/23,Maeda BB,14,596,89,88 %,97,,受電 ,配送遅延 / Delivery delay,エスカレーション,12:36:00,12:39
23-10-2025,Ogawa DD,NULL,519,150,94,98,クレーム傾向あり,チャット,その他 / Other,Transfer to L2,2025-10-23T19:45:00+09:00,2025-10-23T19:59:00+09:00
2025-10-23T00:00:00+09:00,スズキ,NULL,416,69,95,89,"※手動で確認, double break?, N/A",メール,返品 / Return,コールバック予定,2025-10-23T16:48:00+09:00,2025-10-23T16:56:00+09:00
23-10-2025,スズキ,11,565,80,95 %,93,,発信 ,請求 / Billing,Resolved,2025/10/23 16:29,2025/10/23 16:33
2025-10-23T00:00:00+09:00,Sofia V,３３,340,,78,98,,発信 ,返品 / Return,Resolved,2025/10/23 09:15,09:35:00
23-10-2025,ハヤシ,32,201,99,100,NUL,,Outbound,その他 / Other,Partially Resolved,2025/10/23 15:04,15:17
10/23/2025,Kimura Q,NUL,291,80,97 %,,"double break?
QA to review",メール,その他 / Other,Partially Resolved,10:41,2025/10/23 10:54
2025-10-23T00:00:00+09:00, Maria R ,17,381,97,83,94,"weird spike
※手動で確認",Inbound,アカウント / Account,一次対応のみ,2025/10/23 13:04,13:20:00
2025-10-24T00:00:00+09:00,タナカ,29,３７１,99 %,84 %,94,※手動で確認,メール,その他 / Other,Resolved,2025-10-24T17:48:00+09:00,2025/10/24 17:58
2025-10-24T00:00:00, Maria R ,35,517,65,95,95,"needs coaching
VIP customer",チャット,その他 / Other,Unresolved,2025/10/24 16:07,2025-10-24T16:24:00+09:00
10/24/2025,Ogawa DD,27,197,98,84,96,"新人対応, 日本語メモあり",Inbound,返品 / Return,解決済み / Resolved,2025/10/24 18:00,2025-10-24T18:06:00+09:00
2025/10/24,スズキ,NUL,NULL,75,80,89,"urgent
日本語メモあり",メール,支払いエラー / Payment error,解決済み / Resolved,09:45:00,2025-10-24T10:03:00+09:00
2025-10-24T00:00:00+09:00, Maria R ,33,４６２,84 %,82,88,"QA to review, ※手動で確認, customer requested callback",OUT-BOUND,請求 / Billing,Transfer to L2,2025-10-24T10:31:00+09:00,10:43:00
24-10-2025,Sasaki M,21,NULL,68 %,94,95 %,"VIP customer
manual check required",OUT-BOUND,技術サポート / Tech support,解決済み / Resolved,18:21,2025-10-24T18:31:00+09:00
2025年10月24日, Maria R ,44,7200,85 %,NULL,93,,発信,返品 / Return,エスカレーション,2025-10-24T10:12:00+09:00,2025-10-24T10:16:00+09:00
2025/10/24,FUJITA CC,12,218,150 %,88,94,,OUT-BOUND,支払いエラー / Payment error,エスカレーション,09:29,09:40
2025年10月24日,SHIMIZU S,18,NULL,65 %,96,98,"double break?, 新人対応",受電,技術サポート / Tech support,Partially Resolved,2025-10-24T19:11:00+09:00,19:27
10/24/2025,ハヤシ,39,465 sec,73,100,88,"クレーム傾向あり, customer requested callback",Inbound,請求 / Billing,コールバック予定,2025/10/24 17:56,18:11:00
2025/10/24, Mori V ,42,NULL,68,86,91,"needs coaching, customer requested callback, 日本語メモあり",発信 ,請求 / Billing,Resolved,15:19,2025/10/24 15:23
24-10-2025,Okada LL,22,322,67,96,90,,OUT-BOUND,返品 / Return,エスカレーション,19:47:00,2025-10-24T19:54:00+09:00
2025-10-24T00:00:00+09:00,FUJITA CC,,7200,89,100,97 %,"double break?
customer requested callback
needs coaching",Inbound,アカウント / Account,解決済み / Resolved,09:37,09:42
24-10-2025,ハヤシ,39,452,67,88,96,日本語メモあり,発信 ,キャンセル / Cancellation,Partially Resolved,12:27,2025/10/24 12:33
2025-10-24T00:00:00,Alex Q,15,464,74,８７,１００,"double break?
weird spike",受電,技術サポート / Tech support,エスカレーション,14:24:00,2025/10/24 14:35
10/24/2025,nakamura h,NUL,5,NUL,98,96,,OUT-BOUND,返品 / Return,エスカレーション,2025/10/24 18:59,19:11
2025/10/24,ヤマダ,14,249,77,85,,,発信 ,支払いエラー / Payment error,Unresolved,2025/10/24 17:44,2025-10-24T17:57:00+09:00
2025-10-24T00:00:00+09:00,タナカ,30,7200,90 %,,90,needs coaching,Outbound,請求 / Billing,エスカレーション,10:01,10:06
2025/10/24,ハヤシ,３７,5,,９５,94,"double break?
※手動で確認
VIP customer",inbound ,キャンセル / Cancellation,Unresolved,11:28:00,2025/10/24 11:44
2025-10-24T00:00:00,INOUE P,31,548,84,85,NULL,"urgent, double break?, N/A",OUT-BOUND,その他 / Other,Unresolved,2025/10/24 15:28,15:31:00
10/24/2025,Sasaki M,18,5,93,95,97,,OUT-BOUND,技術サポート / Tech support,Partially Resolved,14:00:00,2025/10/24 14:04
2025-10-24T00:00:00+09:00, Kato J ,NUL,319,91,95,NULL,"※手動で確認, customer requested callback",チャット,請求 / Billing,Transfer to L2,,
24-10-2025,Sakamoto II,28,5,NULL,97,96,"weird spike
※手動で確認",発信 ,キャンセル / Cancellation,Unresolved,2025/10/24 20:04,2025-10-24T20:23:00+09:00
10/24/2025,Sakamoto II,11,5,NULL,,NULL,"※手動で確認, weird spike",メール,支払いエラー / Payment error,Unresolved,12:55:00,2025/10/24 12:58
2025-10-24T00:00:00+09:00,ワタナベ,16,438,68,97,88 %,日本語メモあり,発信,支払いエラー / Payment error,Partially Resolved,2025/10/24 10:48,2025/10/24 11:06
24-10-2025,ヤマダ,NUL,378,87,79,92,"N/A, 日本語メモあり",Inbound,返品 / Return,エスカレーション,2025-10-24T14:14:00+09:00,2025/10/24 14:27
2025/10/24,Maeda BB,38,7200,NULL,79,89,"新人対応, urgent, VIP customer",発信 ,アカウント / Account,一次対応のみ,16:31,2025-10-24T16:37:00+09:00
10/24/2025,Emily T,16,7200,100 %,95,96 %,,メール,キャンセル / Cancellation,Partially Resolved,21:49,21:56
10/24/2025,ITO F,34,462,95 %,99,89,"VIP customer, double break?",OUT-BOUND,支払いエラー / Payment error,Transfer to L2,09:47,2025/10/24 09:53
2025-10-24T00:00:00, Saito T ,10,596,75,100,90,日本語メモあり,Inbound,アカウント / Account,Resolved,,
2025年10月25日,Ogawa DD,34,593,90,99,92,double break?,発信,アカウント / Account,一次対応のみ,2025/10/25 21:09,2025-10-25T21:27:00+09:00
10/25/2025,Goto NN,31,236,96,NULL,93,,チャット,キャンセル / Cancellation,Unresolved,2025/10/25 15:54,15:58
25-10-2025,NAKAJIMA AA,19,568,92,79,,,受電 ,その他 / Other,Resolved,14:24,2025/10/25 14:35
25-10-2025,HASEGAWA KK,NULL,5,79,92,93,customer requested callback,メール,アカウント / Account,コールバック予定,11:57:00,2025-10-25T12:14:00+09:00
10/25/2025,Emily T,１８,373,78,95,90,"VIP customer, クレーム傾向あり",発信 ,技術サポート / Tech support,コールバック予定,2025/10/25 19:44,19:47
2025-10-25T00:00:00,スズキ,33,357,74,80,94,"manual check required, VIP customer, N/A",inbound ,その他 / Other,エスカレーション,2025-10-25T16:45:00+09:00,2025-10-25T16:58:00+09:00
2025/10/25,ROMAN P,21,563,68,98,95,"needs coaching, 新人対応, double break?",inbound ,キャンセル / Cancellation,Unresolved,2025/10/25 18:56,19:16
2025年10月25日,ヤマダ,16,184,150 %,91,88 %,"urgent
manual check required",発信,支払いエラー / Payment error,解決済み / Resolved,2025-10-25T15:34:00+09:00,15:37
10/25/2025,Alex Q,38,7200,65,84,92,,Inbound,その他 / Other,Unresolved,2025-10-25T18:17:00+09:00,18:34
2025-10-25T00:00:00, Maria R ,30,NUL,100,85,90,urgent,Inbound,アカウント / Account,Partially Resolved,2025/10/25 14:41,2025-10-25T14:45:00+09:00
10/25/2025,ハヤシ,38,267,87,86,95,"日本語メモあり, QA to review",チャット,アカウント / Account,解決済み / Resolved,,
2025-10-25T00:00:00,kondo ff,20,NUL,88,85,88,,Outbound,返品 / Return,Partially Resolved,NULL,NULL
2025年10月25日,Miyazaki JJ,31,238,83,79,96,"weird spike, double break?, VIP customer",メール,返品 / Return,コールバック予定,2025-10-25T11:37:00+09:00,11:53:00
25-10-2025, Maria R ,24,583,150,88,97,,OUT-BOUND,返品 / Return,エスカレーション,15:12:00,15:17:00
2025-10-25T00:00:00,Maeda BB,34,317,86,96,NUL,,発信,配送遅延 / Delivery delay,Partially Resolved,20:25:00,2025/10/25 20:32
2025-10-25T00:00:00+09:00,Goto NN,42,376,92 %,85 %,90,"urgent
※手動で確認",OUT-BOUND,支払いエラー / Payment error,Resolved,14:44:00,2025-10-25T14:54:00+09:00
2025-10-25T00:00:00+09:00,TAKAHASHI C,18,333,93,98,93,,Inbound,返品 / Return,一次対応のみ,2025-10-25T19:51:00+09:00,20:04
2025-10-25T00:00:00,サトウ,44,7200,89,84,96,urgent,受電 ,キャンセル / Cancellation,コールバック予定,13:03:00,13:22
2025/10/25,サトウ,30,424,,90,93,"VIP customer
N/A",発信 ,アカウント / Account,Unresolved,2025-10-25T17:10:00+09:00,17:18
25-10-2025,Murakami EE,35,333,150,98 %,90,,メール,請求 / Billing,解決済み / Resolved,2025/10/25 21:00,2025-10-25T21:16:00+09:00
10/25/2025,ハヤシ,26,206,150 %,98 %,97 %,customer requested callback,チャット,返品 / Return,Unresolved,11:10,2025/10/25 11:22
25-10-2025,ワタナベ,,450,,90,88,,メール,返品 / Return,Transfer to L2,09:00:00,2025/10/25 09:13
10/25/2025,Alex Q,19,285,72 %,97,92,,チャット,キャンセル / Cancellation,一次対応のみ,2025/10/25 10:58,11:07:00
10/25/2025, Mori V ,12,584,67,80,NULL,needs coaching,発信,返品 / Return,Unresolved,,
2025年10月25日,Maeda BB,38,219,92,94,100,"N/A
VIP customer
weird spike",OUT-BOUND,アカウント / Account,解決済み / Resolved,13:44:00,2025-10-25T14:01:00+09:00
2025-10-25T00:00:00,Ikeda X,10,352,82,86,100 %,"クレーム傾向あり
needs coaching",受電,技術サポート / Tech support,一次対応のみ,2025/10/25 16:54,17:10:00
2025-10-25T00:00:00+09:00,TAKAHASHI C,35,5,87,91,100,N/A,Inbound,配送遅延 / Delivery delay,解決済み / Resolved,2025-10-25T09:09:00+09:00,2025-10-25T09:26:00+09:00
2025/10/25,miyazaki jj,12,467,91,88,92,,inbound ,アカウント / Account,エスカレーション,,
10/25/2025,Sakamoto II,17,NULL,91,96,100,"weird spike, クレーム傾向あり",発信 ,技術サポート / Tech support,コールバック予定,16:48,2025/10/25 16:57
2025-10-25T00:00:00,Sakamoto II,30,191,73,79,99,"新人対応
日本語メモあり
QA to review",OUT-BOUND,技術サポート / Tech support,Resolved,2025-10-25T15:48:00+09:00,2025/10/25 15:56
2025/10/26,Yamazaki U,42,5,99,95,100,"VIP customer, 日本語メモあり",メール,キャンセル / Cancellation,Unresolved,15:37,2025-10-26T15:49:00+09:00
2025-10-26T00:00:00+09:00,WATANABE E,29,534 sec,91,97,95,"urgent, ※手動で確認, weird spike",受電 ,キャンセル / Cancellation,Partially Resolved,2025-10-26T21:03:00+09:00,2025/10/26 21:10
2025/10/26,Suzuki B,NUL,182,79,98,88,,発信 ,請求 / Billing,Resolved,2025-10-26T14:00:00+09:00,2025/10/26 14:09
2025/10/26,Kobayashi I,36,7200,78 %,79,89,"QA to review, クレーム傾向あり, urgent",メール,キャンセル / Cancellation,Transfer to L2,21:01:00,21:04
26-10-2025,Ikeda X,２７,181,NULL,90,94,weird spike,発信,技術サポート / Tech support,Unresolved,2025/10/26 15:12,15:23
2025年10月26日,Ikeda X,43,183 sec,,99,93,weird spike,Outbound,技術サポート / Tech support,Unresolved,2025-10-26T17:58:00+09:00,18:09
10/26/2025,Fujii MM,３８,330,84 %,100,99,"manual check required, 日本語メモあり",受電,キャンセル / Cancellation,Unresolved,10:22:00,10:39:00
10/26/2025,kondo ff,22,199,98,82,98,,メール,請求 / Billing,コールバック予定,2025/10/26 11:10,2025/10/26 11:26
2025-10-26T00:00:00,Sakamoto II,36,373,74,95,95,"新人対応
double break?
customer requested callback",受電,技術サポート / Tech support,一次対応のみ,NULL,NULL
2025/10/26,Kondo OO,16,561,NUL,90 %,,,メール,技術サポート / Tech support,エスカレーション,15:09,2025-10-26T15:14:00+09:00
26-10-2025,Yamamoto G,14,NULL,96,９５,94,VIP customer,OUT-BOUND,キャンセル / Cancellation,解決済み / Resolved,14:39:00,14:46
2025/10/26,INOUE P,37,232,90 %,95,,"QA to review
クレーム傾向あり",inbound ,支払いエラー / Payment error,エスカレーション,NULL,NULL
10/26/2025,Fujii MM,43,425,83,,92,,Outbound,支払いエラー / Payment error,Partially Resolved,2025-10-26T16:42:00+09:00,2025/10/26 16:55
10/26/2025, Abe W ,２０,359 sec,76,88,99 %,,発信,返品 / Return,Partially Resolved,16:02:00,16:11:00
10/26/2025,TAKAHASHI C,10,193,73,80,95,double break?,inbound ,配送遅延 / Delivery delay,Resolved,16:44:00,2025-10-26T16:54:00+09:00
2025年10月26日,TAKAHASHI C,２６,465,99,81,99,"manual check required
needs coaching
QA to review",発信,その他 / Other,解決済み / Resolved,2025-10-26T09:18:00+09:00,09:21:00
2025年10月26日,Goto NN,NUL,189,99 %,NULL,98,"VIP customer, 日本語メモあり, weird spike",受電 ,アカウント / Account,一次対応のみ,2025-10-26T19:44:00+09:00,19:47
2025年10月26日,Sakamoto II,３１,324,78,91,95,"日本語メモあり
QA to review
新人対応",発信 ,その他 / Other,解決済み / Resolved,2025-10-26T18:10:00+09:00,18:14:00
2025-10-26T00:00:00,NAKAJIMA AA,NULL,254,NUL,９５,94,,受電,技術サポート / Tech support,一次対応のみ,2025/10/26 16:51,2025-10-26T16:59:00+09:00
10/26/2025, Mori V ,33,551,73,80,89,"※手動で確認, QA to review, 新人対応",受電,請求 / Billing,コールバック予定,2025-10-26T11:15:00+09:00,11:28:00
2025-10-26T00:00:00,NAKAJIMA AA,NUL,５５８,100,,96,"weird spike
日本語メモあり",Outbound,アカウント / Account,解決済み / Resolved,2025-10-26T14:02:00+09:00,2025/10/26 14:09
2025-10-26T00:00:00,TAKAHASHI C,１７,202,NUL,98 %,88,"double break?, N/A",発信 ,配送遅延 / Delivery delay,Partially Resolved,NULL,NULL
26-10-2025,Fujii MM,12,358,85,98,99,"weird spike
クレーム傾向あり",受電 ,技術サポート / Tech support,Resolved,20:35,20:50:00
2025年10月26日,Yamamoto G,35,NUL,88 %,93 %,94 %,"needs coaching, QA to review",メール,アカウント / Account,解決済み / Resolved,2025/10/26 16:00,2025/10/26 16:12
2025-10-26T00:00:00+09:00,INOUE P,14,216,,99,100 %,"クレーム傾向あり, 新人対応",チャット,請求 / Billing,Unresolved,13:19:00,2025/10/26 13:24
2025年10月26日, Maria R ,NULL,315,NUL,100,93,double break?,受電 ,アカウント / Account,コールバック予定,20:59,2025/10/26 21:11
10/26/2025,john s,45,545,94,８９,91,"needs coaching
クレーム傾向あり
※手動で確認",inbound ,支払いエラー / Payment error,Unresolved,11:01,11:15
26-10-2025,Sasaki M,40,287,67,82,100,"manual check required
urgent
※手動で確認",発信,返品 / Return,Unresolved,2025-10-26T12:46:00+09:00,13:06
26-10-2025,ROMAN P,16,213,76,84,NUL,customer requested callback,発信,配送遅延 / Delivery delay,Transfer to L2,2025/10/26 10:21,2025-10-26T10:32:00+09:00
2025年10月26日,Emily T,14,243 sec,90,84,98,,発信,その他 / Other,エスカレーション,2025-10-26T12:13:00+09:00,2025/10/26 12:18
2025年10月27日,Sakamoto II,11,２８６,67,97,８９,"※手動で確認
VIP customer
日本語メモあり",発信,キャンセル / Cancellation,解決済み / Resolved,19:41,2025/10/27 19:57
10/27/2025,Matsumoto O,NUL,181,150,90,98,"QA to review
VIP customer",発信 ,その他 / Other,一次対応のみ,14:38,2025/10/27 14:56
2025/10/27,サトウ,27,219,67,８８,99,"※手動で確認
weird spike",Outbound,キャンセル / Cancellation,コールバック予定,2025-10-27T10:08:00+09:00,2025-10-27T10:14:00+09:00
2025/10/27,john s,31,7200,76,100,91,"新人対応
※手動で確認",OUT-BOUND,配送遅延 / Delivery delay,コールバック予定,NULL,NULL
2025/10/27,Hayashi R,18,４５９,83 %,90,99,"VIP customer, customer requested callback",メール,アカウント / Account,解決済み / Resolved,21:43:00,2025/10/27 21:56
27-10-2025,Yamazaki U,10,407,NULL,79,NULL,needs coaching,チャット,配送遅延 / Delivery delay,エスカレーション,2025/10/27 19:32,19:48:00
2025年10月27日,Goto NN,３２,310,,92,96,,Inbound,アカウント / Account,コールバック予定,14:16:00,14:29:00
2025-10-27T00:00:00,Kondo OO,40,7200,77,９５,93,"日本語メモあり, weird spike",inbound ,キャンセル / Cancellation,一次対応のみ,11:58,2025-10-27T12:07:00+09:00
2025年10月27日,Sasaki M,44,195,69,78,NUL,"新人対応
customer requested callback
double break?",メール,配送遅延 / Delivery delay,Unresolved,17:17:00,2025-10-27T17:23:00+09:00
2025年10月27日, Kato J ,39,373,65,98,93,manual check required,inbound ,請求 / Billing,一次対応のみ,13:09:00,13:13
2025/10/27,john s,11,258 sec,NUL,99,93,,メール,支払いエラー / Payment error,コールバック予定,20:17,20:36:00
2025/10/27,Ikeda X,42,472,75,98,100,"クレーム傾向あり
weird spike",発信,返品 / Return,解決済み / Resolved,2025-10-27T15:25:00+09:00,15:33:00
2025/10/27,Alex Q,15,330,86,９５,90,,発信,支払いエラー / Payment error,エスカレーション,18:32,2025/10/27 18:35
2025/10/27,WATANABE E,NULL,587,99,99,95,,発信,アカウント / Account,エスカレーション,NULL,NULL
2025/10/27, Yamaguchi N ,12,416,NUL,79,97,,受電 ,返品 / Return,一次対応のみ,17:32,2025-10-27T17:49:00+09:00
10/27/2025,WATANABE E,19,235,66,80,NULL,"double break?, クレーム傾向あり, VIP customer",Inbound,請求 / Billing,解決済み / Resolved,,
10/27/2025,Sakamoto II,12,7200,79,95,91,"manual check required, ※手動で確認",発信,技術サポート / Tech support,Partially Resolved,2025/10/27 20:20,20:24
2025年10月27日,Yamazaki U,３８,300,78 %,98 %,93,"needs coaching, クレーム傾向あり, 新人対応",Outbound,キャンセル / Cancellation,一次対応のみ,13:02,2025-10-27T13:14:00+09:00
2025年10月27日, Saito T ,NULL,206,79,79,93,"customer requested callback, needs coaching, 日本語メモあり",発信,その他 / Other,エスカレーション,17:03:00,17:10:00
2025/10/27,nakamura h,36,330 sec,79,91,NUL,,OUT-BOUND,配送遅延 / Delivery delay,エスカレーション,2025-10-27T12:48:00+09:00,13:06:00
10/27/2025,Sofia V,20,255,100,79,93,weird spike,Inbound,アカウント / Account,Transfer to L2,10:35,2025/10/27 10:49
2025-10-27T00:00:00,Kimura Q,23,421,87,95,92,"needs coaching
新人対応",inbound ,請求 / Billing,Unresolved,10:32:00,2025-10-27T10:38:00+09:00
2025年10月27日,NAKAJIMA AA,40,541,96,82,94,,Outbound,技術サポート / Tech support,Unresolved,2025/10/27 15:54,16:08
2025/10/27,ITO F,36,487,69 %,90,88,,Outbound,キャンセル / Cancellation,解決済み / Resolved,10:57,2025/10/27 11:06
2025年10月27日, Abe W ,１１,494 sec,NULL,90,91,,メール,アカウント / Account,Transfer to L2,2025-10-27T15:56:00+09:00,2025-10-27T16:08:00+09:00
10/27/2025,Ishikawa Z,18,5,87,97,98,"double break?
needs coaching",inbound ,技術サポート / Tech support,Partially Resolved,21:58:00,22:18:00
27-10-2025, Saito T ,23,318,100,95,,weird spike,チャット,キャンセル / Cancellation,コールバック予定,20:47,20:52
2025-10-27T00:00:00,Murakami EE,NUL,481,85,100 %,,新人対応,受電,アカウント / Account,Resolved,2025-10-27T17:12:00+09:00,2025-10-27T17:16:00+09:00
27-10-2025,Ogawa DD,40,5,70,86,98,"needs coaching
クレーム傾向あり
新人対応",発信 ,アカウント / Account,Transfer to L2,2025-10-27T15:19:00+09:00,2025/10/27 15:26
2025/10/27,Ikeda X,10,476,69,１００,,,inbound ,請求 / Billing,コールバック予定,NULL,NULL
2025-10-28T00:00:00+09:00,Goto NN,１６,193,NULL,NUL,９７,"QA to review
weird spike",受電 ,請求 / Billing,Unresolved,NULL,NULL
2025-10-28T00:00:00+09:00,Goto NN,18,NUL,73,NULL,97,,Outbound,キャンセル / Cancellation,一次対応のみ,12:14:00,12:20
